17:40:21.062781 IP 192.168.122.1.60367 > 192.168.122.239.9801: Flags [S], seq 3691818470, win 29200, options [mss 1460,sackOK,TS val 413336609 ecr 0,nop,wscale 7], length 0
17:40:21.062809 IP 192.168.122.239.9801 > 192.168.122.1.60367: Flags [S.], seq 300954309, ack 3691818471, win 28960, options [mss 1460,sackOK,TS val 4185020624 ecr 413336609,nop,wscale 7], length 0
17:40:21.062895 IP 192.168.122.1.60367 > 192.168.122.239.9801: Flags [.], ack 300954310, win 229, options [nop,nop,TS val 413336609 ecr 4185020624], length 0
17:40:21.062924 IP 192.168.122.1.60367 > 192.168.122.239.9801: Flags [P.], seq 3691818471:3691818495, ack 300954310, win 229, options [nop,nop,TS val 413336609 ecr 4185020624], length 24
17:40:21.062934 IP 192.168.122.239.9801 > 192.168.122.1.60367: Flags [.], ack 3691818495, win 227, options [nop,nop,TS val 4185020624 ecr 413336609], length 0
17:40:21.062990 IP 192.168.122.1.60368 > 192.168.122.239.9801: Flags [S], seq 454442822, win 29200, options [mss 1460,sackOK,TS val 413336609 ecr 0,nop,wscale 7], length 0
17:40:21.063001 IP 192.168.122.239.9801 > 192.168.122.1.60368: Flags [S.], seq 806152298, ack 454442823, win 28960, options [mss 1460,sackOK,TS val 4185020624 ecr 413336609,nop,wscale 7], length 0
17:40:21.063033 IP 192.168.122.1.60368 > 192.168.122.239.9801: Flags [.], ack 806152299, win 229, options [nop,nop,TS val 413336609 ecr 4185020624], length 0
17:40:21.063072 IP 192.168.122.1.60368 > 192.168.122.239.9801: Flags [P.], seq 454442823:454442847, ack 806152299, win 229, options [nop,nop,TS val 413336609 ecr 4185020624], length 24
17:40:21.063078 IP 192.168.122.239.9801 > 192.168.122.1.60368: Flags [.], ack 454442847, win 227, options [nop,nop,TS val 4185020624 ecr 413336609], length 0
17:40:21.063088 IP 192.168.122.1.60368 > 192.168.122.239.9801: Flags [.], seq 454442847:454455879, ack 806152299, win 229, options [nop,nop,TS val 413336609 ecr 4185020624], length 13032
17:40:21.063093 IP 192.168.122.239.9801 > 192.168.122.1.60368: Flags [.], ack 454455879, win 430, options [nop,nop,TS val 4185020624 ecr 413336609], length 0
17:40:21.063096 IP 192.168.122.1.60367 > 192.168.122.239.9801: Flags [.], seq 3691818495:3691832975, ack 300954310, win 229, options [nop,nop,TS val 413336609 ecr 4185020624], length 14480
17:40:21.063100 IP 192.168.122.239.9801 > 192.168.122.1.60367: Flags [.], ack 3691832975, win 453, options [nop,nop,TS val 4185020624 ecr 413336609], length 0
17:40:21.063132 IP 192.168.122.1.60367 > 192.168.122.239.9801: Flags [P.], seq 3691832975:3691847455, ack 300954310, win 229, options [nop,nop,TS val 413336609 ecr 4185020624], length 14480
17:40:21.063137 IP 192.168.122.239.9801 > 192.168.122.1.60367: Flags [.], ack 3691847455, win 679, options [nop,nop,TS val 4185020624 ecr 413336609], length 0
17:40:21.073860 IP 192.168.122.1.60368 > 192.168.122.239.9801: Flags [.], seq 454470359:454471807, ack 806152299, win 229, options [nop,nop,TS val 413336612 ecr 4185020624], length 1448
17:40:21.073883 IP 192.168.122.1.60367 > 192.168.122.239.9801: Flags [.], seq 3691861935:3691863383, ack 300954310, win 229, options [nop,nop,TS val 413336612 ecr 4185020624], length 1448
17:40:21.073976 IP 192.168.122.239.9801 > 192.168.122.1.60368: Flags [.], ack 454455879, win 453, options [nop,nop,TS val 4185020627 ecr 413336609,nop,nop,sack 1 {454470359:454471807}], length 0
17:40:21.074013 IP 192.168.122.239.9801 > 192.168.122.1.60367: Flags [.], ack 3691847455, win 702, options [nop,nop,TS val 4185020627 ecr 413336609,nop,nop,sack 1 {3691861935:3691863383}], length 0
17:40:21.074215 IP 192.168.122.1.60368 > 192.168.122.239.9801: Flags [.], seq 454455879:454458775, ack 806152299, win 229, options [nop,nop,TS val 413336612 ecr 4185020627], length 2896
17:40:21.074235 IP 192.168.122.1.60367 > 192.168.122.239.9801: Flags [.], seq 3691847455:3691850351, ack 300954310, win 229, options [nop,nop,TS val 413336612 ecr 4185020627], length 2896
17:40:21.074330 IP 192.168.122.239.9801 > 192.168.122.1.60368: Flags [.], ack 454458775, win 498, options [nop,nop,TS val 4185020627 ecr 413336612,nop,nop,sack 1 {454470359:454471807}], length 0
17:40:21.074359 IP 192.168.122.239.9801 > 192.168.122.1.60367: Flags [.], ack 3691850351, win 747, options [nop,nop,TS val 4185020627 ecr 413336612,nop,nop,sack 1 {3691861935:3691863383}], length 0
17:40:21.074578 IP 192.168.122.1.60368 > 192.168.122.239.9801: Flags [.], seq 454458775:454463119, ack 806152299, win 229, options [nop,nop,TS val 413336612 ecr 4185020627], length 4344
17:40:21.074600 IP 192.168.122.1.60367 > 192.168.122.239.9801: Flags [.], seq 3691850351:3691854695, ack 300954310, win 229, options [nop,nop,TS val 413336612 ecr 4185020627], length 4344
17:40:21.074696 IP 192.168.122.239.9801 > 192.168.122.1.60368: Flags [.], ack 454463119, win 566, options [nop,nop,TS val 4185020627 ecr 413336612,nop,nop,sack 1 {454470359:454471807}], length 0
17:40:21.074728 IP 192.168.122.239.9801 > 192.168.122.1.60367: Flags [.], ack 3691854695, win 815, options [nop,nop,TS val 4185020627 ecr 413336612,nop,nop,sack 1 {3691861935:3691863383}], length 0
17:40:21.074945 IP 192.168.122.1.60368 > 192.168.122.239.9801: Flags [.], seq 454463119:454467463, ack 806152299, win 229, options [nop,nop,TS val 413336612 ecr 4185020627], length 4344
17:40:21.074973 IP 192.168.122.1.60367 > 192.168.122.239.9801: Flags [.], seq 3691854695:3691859039, ack 300954310, win 229, options [nop,nop,TS val 413336612 ecr 4185020627], length 4344
17:40:21.075020 IP 192.168.122.1.60368 > 192.168.122.239.9801: Flags [.], seq 454471807:454473255, ack 806152299, win 229, options [nop,nop,TS val 413336612 ecr 4185020627], length 1448
17:40:21.075024 IP 192.168.122.1.60367 > 192.168.122.239.9801: Flags [.], seq 3691863383:3691864831, ack 300954310, win 229, options [nop,nop,TS val 413336612 ecr 4185020627], length 1448
17:40:21.075076 IP 192.168.122.239.9801 > 192.168.122.1.60368: Flags [.], ack 454467463, win 634, options [nop,nop,TS val 4185020627 ecr 413336612,nop,nop,sack 1 {454470359:454471807}], length 0
17:40:21.075103 IP 192.168.122.239.9801 > 192.168.122.1.60367: Flags [.], ack 3691859039, win 883, options [nop,nop,TS val 4185020627 ecr 413336612,nop,nop,sack 1 {3691861935:3691863383}], length 0
17:40:21.075108 IP 192.168.122.239.9801 > 192.168.122.1.60367: Flags [.], ack 3691859039, win 905, options [nop,nop,TS val 4185020627 ecr 413336612,nop,nop,sack 1 {3691861935:3691864831}], length 0
17:40:21.075118 IP 192.168.122.239.9801 > 192.168.122.1.60368: Flags [.], ack 454467463, win 657, options [nop,nop,TS val 4185020627 ecr 413336612,nop,nop,sack 1 {454470359:454473255}], length 0
17:40:21.075365 IP 192.168.122.1.60368 > 192.168.122.239.9801: Flags [.], seq 454473255:454479047, ack 806152299, win 229, options [nop,nop,TS val 413336612 ecr 4185020627], length 5792
17:40:21.075390 IP 192.168.122.1.60367 > 192.168.122.239.9801: Flags [.], seq 3691864831:3691870623, ack 300954310, win 229, options [nop,nop,TS val 413336612 ecr 4185020627], length 5792
17:40:21.075443 IP 192.168.122.1.60367 > 192.168.122.239.9801: Flags [.], seq 3691859039:3691860487, ack 300954310, win 229, options [nop,nop,TS val 413336612 ecr 4185020627], length 1448
17:40:21.075450 IP 192.168.122.1.60368 > 192.168.122.239.9801: Flags [.], seq 454467463:454468911, ack 806152299, win 229, options [nop,nop,TS val 413336612 ecr 4185020627], length 1448
17:40:21.075454 IP 192.168.122.1.60367 > 192.168.122.239.9801: Flags [.], seq 3691870623:3691872071, ack 300954310, win 229, options [nop,nop,TS val 413336612 ecr 4185020627], length 1448
17:40:21.075458 IP 192.168.122.1.60368 > 192.168.122.239.9801: Flags [.], seq 454479047:454480495, ack 806152299, win 229, options [nop,nop,TS val 413336612 ecr 4185020627], length 1448
17:40:21.075509 IP 192.168.122.239.9801 > 192.168.122.1.60368: Flags [.], ack 454467463, win 747, options [nop,nop,TS val 4185020628 ecr 413336612,nop,nop,sack 1 {454470359:454479047}], length 0
17:40:21.075541 IP 192.168.122.239.9801 > 192.168.122.1.60367: Flags [.], ack 3691859039, win 996, options [nop,nop,TS val 4185020628 ecr 413336612,nop,nop,sack 1 {3691861935:3691870623}], length 0
17:40:21.075546 IP 192.168.122.239.9801 > 192.168.122.1.60367: Flags [.], ack 3691860487, win 1019, options [nop,nop,TS val 4185020628 ecr 413336612,nop,nop,sack 1 {3691861935:3691870623}], length 0
17:40:21.075549 IP 192.168.122.239.9801 > 192.168.122.1.60367: Flags [.], ack 3691860487, win 1041, options [nop,nop,TS val 4185020628 ecr 413336612,nop,nop,sack 1 {3691861935:3691872071}], length 0
17:40:21.075562 IP 192.168.122.239.9801 > 192.168.122.1.60368: Flags [.], ack 454468911, win 770, options [nop,nop,TS val 4185020628 ecr 413336612,nop,nop,sack 1 {454470359:454479047}], length 0
17:40:21.075571 IP 192.168.122.239.9801 > 192.168.122.1.60368: Flags [.], ack 454468911, win 792, options [nop,nop,TS val 4185020628 ecr 413336612,nop,nop,sack 1 {454470359:454480495}], length 0
17:40:21.075814 IP 192.168.122.1.60368 > 192.168.122.239.9801: Flags [P.], seq 454468911:454470359, ack 806152299, win 229, options [nop,nop,TS val 413336612 ecr 4185020628], length 1448
17:40:21.075837 IP 192.168.122.1.60368 > 192.168.122.239.9801: Flags [.], seq 454480495:454484839, ack 806152299, win 229, options [nop,nop,TS val 413336612 ecr 4185020628], length 4344
17:40:21.075845 IP 192.168.122.1.60367 > 192.168.122.239.9801: Flags [.], seq 3691860487:3691861935, ack 300954310, win 229, options [nop,nop,TS val 413336612 ecr 4185020628], length 1448
17:40:21.075891 IP 192.168.122.1.60367 > 192.168.122.239.9801: Flags [P.], seq 3691872071:3691876415, ack 300954310, win 229, options [nop,nop,TS val 413336612 ecr 4185020628], length 4344
17:40:21.075910 IP 192.168.122.1.60368 > 192.168.122.239.9801: Flags [.], seq 454484839:454489183, ack 806152299, win 229, options [nop,nop,TS val 413336612 ecr 4185020628], length 4344
17:40:21.075916 IP 192.168.122.1.60367 > 192.168.122.239.9801: Flags [.], seq 3691876415:3691880759, ack 300954310, win 229, options [nop,nop,TS val 413336612 ecr 4185020628], length 4344
17:40:21.075971 IP 192.168.122.239.9801 > 192.168.122.1.60368: Flags [.], ack 454480495, win 815, options [nop,nop,TS val 4185020628 ecr 413336612], length 0
17:40:21.076005 IP 192.168.122.239.9801 > 192.168.122.1.60367: Flags [.], ack 3691872071, win 1064, options [nop,nop,TS val 4185020628 ecr 413336612], length 0
17:40:21.076010 IP 192.168.122.239.9801 > 192.168.122.1.60367: Flags [.], ack 3691876415, win 1132, options [nop,nop,TS val 4185020628 ecr 413336612], length 0
17:40:21.076013 IP 192.168.122.239.9801 > 192.168.122.1.60367: Flags [.], ack 3691880759, win 1200, options [nop,nop,TS val 4185020628 ecr 413336612], length 0
17:40:21.076023 IP 192.168.122.239.9801 > 192.168.122.1.60368: Flags [.], ack 454484839, win 883, options [nop,nop,TS val 4185020628 ecr 413336612], length 0
17:40:21.076033 IP 192.168.122.239.9801 > 192.168.122.1.60368: Flags [.], ack 454489183, win 951, options [nop,nop,TS val 4185020628 ecr 413336612], length 0
17:40:21.076248 IP 192.168.122.1.60367 > 192.168.122.239.9801: Flags [.], seq 3691880759:3691887999, ack 300954310, win 229, options [nop,nop,TS val 413336612 ecr 4185020628], length 7240
17:40:21.076311 IP 192.168.122.1.60367 > 192.168.122.239.9801: Flags [.], seq 3691887999:3691890895, ack 300954310, win 229, options [nop,nop,TS val 413336612 ecr 4185020628], length 2896
17:40:21.076320 IP 192.168.122.1.60368 > 192.168.122.239.9801: Flags [.], seq 454489183:454496423, ack 806152299, win 229, options [nop,nop,TS val 413336612 ecr 4185020628], length 7240
17:40:21.076340 IP 192.168.122.1.60368 > 192.168.122.239.9801: Flags [P.], seq 454496423:454499319, ack 806152299, win 229, options [nop,nop,TS val 413336612 ecr 4185020628], length 2896
17:40:21.076393 IP 192.168.122.239.9801 > 192.168.122.1.60368: Flags [.], ack 454496423, win 1064, options [nop,nop,TS val 4185020628 ecr 413336612], length 0
17:40:21.076434 IP 192.168.122.239.9801 > 192.168.122.1.60368: Flags [.], ack 454499319, win 1109, options [nop,nop,TS val 4185020628 ecr 413336612], length 0
17:40:21.076597 IP 192.168.122.1.60368 > 192.168.122.239.9801: Flags [.], seq 454499319:454508007, ack 806152299, win 229, options [nop,nop,TS val 413336612 ecr 4185020628], length 8688
17:40:21.076665 IP 192.168.122.239.9801 > 192.168.122.1.60368: Flags [.], ack 454508007, win 1245, options [nop,nop,TS val 4185020628 ecr 413336612], length 0
17:40:21.076751 IP 192.168.122.239.9801 > 192.168.122.1.60367: Flags [.], ack 3691887999, win 1313, options [nop,nop,TS val 4185020628 ecr 413336612], length 0
17:40:21.076764 IP 192.168.122.239.9801 > 192.168.122.1.60367: Flags [.], ack 3691890895, win 1358, options [nop,nop,TS val 4185020628 ecr 413336612], length 0
17:40:21.076882 IP 192.168.122.1.60368 > 192.168.122.239.9801: Flags [.], seq 454508007:454513799, ack 806152299, win 229, options [nop,nop,TS val 413336612 ecr 4185020628], length 5792
17:40:21.076908 IP 192.168.122.1.60367 > 192.168.122.239.9801: Flags [.], seq 3691890895:3691899583, ack 300954310, win 229, options [nop,nop,TS val 413336612 ecr 4185020628], length 8688
17:40:21.076920 IP 192.168.122.1.60367 > 192.168.122.239.9801: Flags [.], seq 3691899583:3691903927, ack 300954310, win 229, options [nop,nop,TS val 413336612 ecr 4185020628], length 4344
17:40:21.076973 IP 192.168.122.239.9801 > 192.168.122.1.60368: Flags [.], ack 454513799, win 1335, options [nop,nop,TS val 4185020628 ecr 413336612], length 0
17:40:21.077015 IP 192.168.122.239.9801 > 192.168.122.1.60367: Flags [.], ack 3691899583, win 1452, options [nop,nop,TS val 4185020628 ecr 413336612], length 0
17:40:21.077021 IP 192.168.122.239.9801 > 192.168.122.1.60367: Flags [.], ack 3691903927, win 1452, options [nop,nop,TS val 4185020628 ecr 413336612], length 0
17:40:21.077188 IP 192.168.122.1.60368 > 192.168.122.239.9801: Flags [.], seq 454521039:454526831, ack 806152299, win 229, options [nop,nop,TS val 413336612 ecr 4185020628], length 5792
17:40:21.077209 IP 192.168.122.1.60367 > 192.168.122.239.9801: Flags [P.], seq 3691903927:3691911167, ack 300954310, win 229, options [nop,nop,TS val 413336612 ecr 4185020628], length 7240
17:40:21.077284 IP 192.168.122.239.9801 > 192.168.122.1.60367: Flags [.], ack 3691911167, win 1452, options [nop,nop,TS val 4185020628 ecr 413336612], length 0
17:40:21.077321 IP 192.168.122.239.9801 > 192.168.122.1.60368: Flags [.], ack 454513799, win 1426, options [nop,nop,TS val 4185020628 ecr 413336612,nop,nop,sack 1 {454521039:454526831}], length 0
17:40:21.077439 IP 192.168.122.1.60367 > 192.168.122.239.9801: Flags [.], seq 3691916959:3691924199, ack 300954310, win 229, options [nop,nop,TS val 413336612 ecr 4185020628], length 7240
17:40:21.077462 IP 192.168.122.1.60368 > 192.168.122.239.9801: Flags [.], seq 454513799:454521039, ack 806152299, win 229, options [nop,nop,TS val 413336612 ecr 4185020628], length 7240
17:40:21.077501 IP 192.168.122.239.9801 > 192.168.122.1.60368: Flags [.], ack 454526831, win 1436, options [nop,nop,TS val 4185020628 ecr 413336612], length 0
17:40:21.077540 IP 192.168.122.239.9801 > 192.168.122.1.60367: Flags [.], ack 3691911167, win 1452, options [nop,nop,TS val 4185020628 ecr 413336612,nop,nop,sack 1 {3691916959:3691924199}], length 0
17:40:21.077657 IP 192.168.122.1.60368 > 192.168.122.239.9801: Flags [P.], seq 454526831:454534071, ack 806152299, win 229, options [nop,nop,TS val 413336612 ecr 4185020628], length 7240
17:40:21.077679 IP 192.168.122.1.60367 > 192.168.122.239.9801: Flags [.], seq 3691911167:3691916959, ack 300954310, win 229, options [nop,nop,TS val 413336612 ecr 4185020628], length 5792
17:40:21.077685 IP 192.168.122.1.60367 > 192.168.122.239.9801: Flags [.], seq 3691924199:3691927095, ack 300954310, win 229, options [nop,nop,TS val 413336612 ecr 4185020628], length 2896
17:40:21.077757 IP 192.168.122.239.9801 > 192.168.122.1.60367: Flags [.], ack 3691924199, win 1430, options [nop,nop,TS val 4185020628 ecr 413336612], length 0
17:40:21.077778 IP 192.168.122.239.9801 > 192.168.122.1.60367: Flags [.], ack 3691927095, win 1416, options [nop,nop,TS val 4185020628 ecr 413336612], length 0
17:40:21.077805 IP 192.168.122.239.9801 > 192.168.122.1.60368: Flags [.], ack 454534071, win 1452, options [nop,nop,TS val 4185020628 ecr 413336612], length 0
17:40:21.077911 IP 192.168.122.1.60367 > 192.168.122.239.9801: Flags [.], seq 3691927095:3691931439, ack 300954310, win 229, options [nop,nop,TS val 413336613 ecr 4185020628], length 4344
17:40:21.077926 IP 192.168.122.1.60367 > 192.168.122.239.9801: Flags [.], seq 3691931439:3691937231, ack 300954310, win 229, options [nop,nop,TS val 413336613 ecr 4185020628], length 5792
17:40:21.077931 IP 192.168.122.1.60368 > 192.168.122.239.9801: Flags [.], seq 454534071:454544207, ack 806152299, win 229, options [nop,nop,TS val 413336613 ecr 4185020628], length 10136
17:40:21.077967 IP 192.168.122.239.9801 > 192.168.122.1.60368: Flags [.], ack 454544207, win 1452, options [nop,nop,TS val 4185020628 ecr 413336613], length 0
17:40:21.078002 IP 192.168.122.239.9801 > 192.168.122.1.60367: Flags [.], ack 3691931439, win 1452, options [nop,nop,TS val 4185020628 ecr 413336613], length 0
17:40:21.078008 IP 192.168.122.239.9801 > 192.168.122.1.60367: Flags [.], ack 3691937231, win 1452, options [nop,nop,TS val 4185020628 ecr 413336613], length 0
17:40:21.078113 IP 192.168.122.1.60367 > 192.168.122.239.9801: Flags [.], seq 3691937231:3691941575, ack 300954310, win 229, options [nop,nop,TS val 413336613 ecr 4185020628], length 4344
17:40:21.078127 IP 192.168.122.1.60367 > 192.168.122.239.9801: Flags [.], seq 3691941575:3691947367, ack 300954310, win 229, options [nop,nop,TS val 413336613 ecr 4185020628], length 5792
17:40:21.078157 IP 192.168.122.239.9801 > 192.168.122.1.60367: Flags [.], ack 3691941575, win 1452, options [nop,nop,TS val 4185020628 ecr 413336613], length 0
17:40:21.078177 IP 192.168.122.239.9801 > 192.168.122.1.60367: Flags [.], ack 3691947367, win 1452, options [nop,nop,TS val 4185020628 ecr 413336613], length 0
17:40:21.078255 IP 192.168.122.1.60367 > 192.168.122.239.9801: Flags [.], seq 3691947367:3691951711, ack 300954310, win 229, options [nop,nop,TS val 413336613 ecr 4185020628], length 4344
17:40:21.078264 IP 192.168.122.1.60367 > 192.168.122.239.9801: Flags [P.], seq 3691951711:3691957503, ack 300954310, win 229, options [nop,nop,TS val 413336613 ecr 4185020628], length 5792
17:40:21.078288 IP 192.168.122.239.9801 > 192.168.122.1.60367: Flags [.], ack 3691951711, win 1452, options [nop,nop,TS val 4185020628 ecr 413336613], length 0
17:40:21.078305 IP 192.168.122.239.9801 > 192.168.122.1.60367: Flags [.], ack 3691957503, win 1452, options [nop,nop,TS val 4185020628 ecr 413336613], length 0
17:40:21.078386 IP 192.168.122.1.60367 > 192.168.122.239.9801: Flags [.], seq 3691957503:3691961847, ack 300954310, win 229, options [nop,nop,TS val 413336613 ecr 4185020628], length 4344
17:40:21.078460 IP 192.168.122.239.9801 > 192.168.122.1.60367: Flags [.], ack 3691961847, win 1452, options [nop,nop,TS val 4185020628 ecr 413336613], length 0
17:40:21.078559 IP 192.168.122.1.60367 > 192.168.122.239.9801: Flags [.], seq 3691967639:3691971983, ack 300954310, win 229, options [nop,nop,TS val 413336613 ecr 4185020628], length 4344
17:40:21.078611 IP 192.168.122.239.9801 > 192.168.122.1.60367: Flags [.], ack 3691961847, win 1452, options [nop,nop,TS val 4185020628 ecr 413336613,nop,nop,sack 1 {3691967639:3691971983}], length 0
17:40:21.078732 IP 192.168.122.1.60367 > 192.168.122.239.9801: Flags [.], seq 3691961847:3691967639, ack 300954310, win 229, options [nop,nop,TS val 413336613 ecr 4185020628], length 5792
17:40:21.078789 IP 192.168.122.239.9801 > 192.168.122.1.60367: Flags [.], ack 3691971983, win 1442, options [nop,nop,TS val 4185020628 ecr 413336613], length 0
17:40:21.078866 IP 192.168.122.1.60367 > 192.168.122.239.9801: Flags [.], seq 3691971983:3691977775, ack 300954310, win 229, options [nop,nop,TS val 413336613 ecr 4185020628], length 5792
17:40:21.078910 IP 192.168.122.239.9801 > 192.168.122.1.60367: Flags [.], ack 3691977775, win 1452, options [nop,nop,TS val 4185020628 ecr 413336613], length 0
17:40:21.078974 IP 192.168.122.1.60367 > 192.168.122.239.9801: Flags [.], seq 3691977775:3691983567, ack 300954310, win 229, options [nop,nop,TS val 413336613 ecr 4185020628], length 5792
17:40:21.079019 IP 192.168.122.239.9801 > 192.168.122.1.60367: Flags [.], ack 3691983567, win 1452, options [nop,nop,TS val 4185020628 ecr 413336613], length 0
17:40:21.089880 IP 192.168.122.1.60368 > 192.168.122.239.9801: Flags [.], seq 454554343:454555791, ack 806152299, win 229, options [nop,nop,TS val 413336616 ecr 4185020628], length 1448
17:40:21.089907 IP 192.168.122.1.60367 > 192.168.122.239.9801: Flags [.], seq 3691990807:3691992255, ack 300954310, win 229, options [nop,nop,TS val 413336616 ecr 4185020628], length 1448
17:40:21.089970 IP 192.168.122.239.9801 > 192.168.122.1.60368: Flags [.], ack 454544207, win 1452, options [nop,nop,TS val 4185020631 ecr 413336613,nop,nop,sack 1 {454554343:454555791}], length 0
17:40:21.090008 IP 192.168.122.239.9801 > 192.168.122.1.60367: Flags [.], ack 3691983567, win 1452, options [nop,nop,TS val 4185020631 ecr 413336613,nop,nop,sack 1 {3691990807:3691992255}], length 0
17:40:21.090262 IP 192.168.122.1.60368 > 192.168.122.239.9801: Flags [.], seq 454544207:454547103, ack 806152299, win 229, options [nop,nop,TS val 413336616 ecr 4185020631], length 2896
17:40:21.090287 IP 192.168.122.1.60367 > 192.168.122.239.9801: Flags [.], seq 3691983567:3691985015, ack 300954310, win 229, options [nop,nop,TS val 413336616 ecr 4185020631], length 1448
17:40:21.090352 IP 192.168.122.239.9801 > 192.168.122.1.60368: Flags [.], ack 454547103, win 1452, options [nop,nop,TS val 4185020631 ecr 413336616,nop,nop,sack 1 {454554343:454555791}], length 0
17:40:21.090398 IP 192.168.122.239.9801 > 192.168.122.1.60367: Flags [.], ack 3691985015, win 1452, options [nop,nop,TS val 4185020631 ecr 413336616,nop,nop,sack 1 {3691990807:3691992255}], length 0
17:40:21.090547 IP 192.168.122.1.60368 > 192.168.122.239.9801: Flags [.], seq 454547103:454549999, ack 806152299, win 229, options [nop,nop,TS val 413336616 ecr 4185020631], length 2896
17:40:21.090568 IP 192.168.122.1.60367 > 192.168.122.239.9801: Flags [.], seq 3691985015:3691986463, ack 300954310, win 229, options [nop,nop,TS val 413336616 ecr 4185020631], length 1448
17:40:21.090632 IP 192.168.122.239.9801 > 192.168.122.1.60368: Flags [.], ack 454549999, win 1452, options [nop,nop,TS val 4185020631 ecr 413336616,nop,nop,sack 1 {454554343:454555791}], length 0
17:40:21.090686 IP 192.168.122.239.9801 > 192.168.122.1.60367: Flags [.], ack 3691986463, win 1452, options [nop,nop,TS val 4185020631 ecr 413336616,nop,nop,sack 1 {3691990807:3691992255}], length 0
17:40:21.090807 IP 192.168.122.1.60368 > 192.168.122.239.9801: Flags [.], seq 454549999:454551447, ack 806152299, win 229, options [nop,nop,TS val 413336616 ecr 4185020631], length 1448
17:40:21.090823 IP 192.168.122.1.60368 > 192.168.122.239.9801: Flags [.], seq 454555791:454557239, ack 806152299, win 229, options [nop,nop,TS val 413336616 ecr 4185020631], length 1448
17:40:21.090825 IP 192.168.122.1.60367 > 192.168.122.239.9801: Flags [.], seq 3691986463:3691987911, ack 300954310, win 229, options [nop,nop,TS val 413336616 ecr 4185020631], length 1448
17:40:21.090864 IP 192.168.122.239.9801 > 192.168.122.1.60368: Flags [.], ack 454551447, win 1452, options [nop,nop,TS val 4185020631 ecr 413336616,nop,nop,sack 1 {454554343:454555791}], length 0
17:40:21.090885 IP 192.168.122.239.9801 > 192.168.122.1.60368: Flags [.], ack 454551447, win 1452, options [nop,nop,TS val 4185020631 ecr 413336616,nop,nop,sack 1 {454554343:454557239}], length 0
17:40:21.090901 IP 192.168.122.239.9801 > 192.168.122.1.60367: Flags [.], ack 3691987911, win 1452, options [nop,nop,TS val 4185020631 ecr 413336616,nop,nop,sack 1 {3691990807:3691992255}], length 0
17:40:21.091142 IP 192.168.122.1.60368 > 192.168.122.239.9801: Flags [.], seq 454557239:454558687, ack 806152299, win 229, options [nop,nop,TS val 413336616 ecr 4185020631], length 1448
17:40:21.091168 IP 192.168.122.1.60368 > 192.168.122.239.9801: Flags [.], seq 454551447:454552895, ack 806152299, win 229, options [nop,nop,TS val 413336616 ecr 4185020631], length 1448
17:40:21.091174 IP 192.168.122.1.60368 > 192.168.122.239.9801: Flags [.], seq 454558687:454560135, ack 806152299, win 229, options [nop,nop,TS val 413336616 ecr 4185020631], length 1448
17:40:21.091177 IP 192.168.122.1.60367 > 192.168.122.239.9801: Flags [.], seq 3691992255:3691993703, ack 300954310, win 229, options [nop,nop,TS val 413336616 ecr 4185020631], length 1448
17:40:21.091382 IP 192.168.122.239.9801 > 192.168.122.1.60368: Flags [.], ack 454551447, win 1452, options [nop,nop,TS val 4185020632 ecr 413336616,nop,nop,sack 1 {454554343:454558687}], length 0
17:40:21.091416 IP 192.168.122.239.9801 > 192.168.122.1.60368: Flags [.], ack 454552895, win 1441, options [nop,nop,TS val 4185020632 ecr 413336616,nop,nop,sack 1 {454554343:454558687}], length 0
17:40:21.091422 IP 192.168.122.239.9801 > 192.168.122.1.60368: Flags [.], ack 454552895, win 1441, options [nop,nop,TS val 4185020632 ecr 413336616,nop,nop,sack 1 {454554343:454560135}], length 0
17:40:21.091448 IP 192.168.122.239.9801 > 192.168.122.1.60367: Flags [.], ack 3691987911, win 1452, options [nop,nop,TS val 4185020632 ecr 413336616,nop,nop,sack 1 {3691990807:3691993703}], length 0
17:40:21.091654 IP 192.168.122.1.60368 > 192.168.122.239.9801: Flags [.], seq 454552895:454554343, ack 806152299, win 229, options [nop,nop,TS val 413336616 ecr 4185020632], length 1448
17:40:21.091683 IP 192.168.122.1.60367 > 192.168.122.239.9801: Flags [.], seq 3691987911:3691989359, ack 300954310, win 229, options [nop,nop,TS val 413336616 ecr 4185020632], length 1448
17:40:21.091729 IP 192.168.122.1.60368 > 192.168.122.239.9801: Flags [.], seq 454560135:454564479, ack 806152299, win 229, options [nop,nop,TS val 413336616 ecr 4185020632], length 4344
17:40:21.091734 IP 192.168.122.1.60367 > 192.168.122.239.9801: Flags [.], seq 3691993703:3691995151, ack 300954310, win 229, options [nop,nop,TS val 413336616 ecr 4185020632], length 1448
17:40:21.091774 IP 192.168.122.239.9801 > 192.168.122.1.60368: Flags [.], ack 454560135, win 1430, options [nop,nop,TS val 4185020632 ecr 413336616], length 0
17:40:21.091801 IP 192.168.122.239.9801 > 192.168.122.1.60368: Flags [.], ack 454564479, win 1406, options [nop,nop,TS val 4185020632 ecr 413336616], length 0
17:40:21.091826 IP 192.168.122.239.9801 > 192.168.122.1.60367: Flags [.], ack 3691989359, win 1446, options [nop,nop,TS val 4185020632 ecr 413336616,nop,nop,sack 1 {3691990807:3691993703}], length 0
17:40:21.091844 IP 192.168.122.239.9801 > 192.168.122.1.60367: Flags [.], ack 3691989359, win 1446, options [nop,nop,TS val 4185020632 ecr 413336616,nop,nop,sack 1 {3691990807:3691995151}], length 0
17:40:21.091986 IP 192.168.122.1.60368 > 192.168.122.239.9801: Flags [.], seq 454564479:454571719, ack 806152299, win 229, options [nop,nop,TS val 413336616 ecr 4185020632], length 7240
17:40:21.092012 IP 192.168.122.1.60367 > 192.168.122.239.9801: Flags [.], seq 3691995151:3691996599, ack 300954310, win 229, options [nop,nop,TS val 413336616 ecr 4185020632], length 1448
17:40:21.092059 IP 192.168.122.1.60367 > 192.168.122.239.9801: Flags [.], seq 3691989359:3691990807, ack 300954310, win 229, options [nop,nop,TS val 413336616 ecr 4185020632], length 1448
17:40:21.092063 IP 192.168.122.1.60367 > 192.168.122.239.9801: Flags [.], seq 3691996599:3691998047, ack 300954310, win 229, options [nop,nop,TS val 413336616 ecr 4185020632], length 1448
17:40:21.092103 IP 192.168.122.239.9801 > 192.168.122.1.60368: Flags [.], ack 454571719, win 1452, options [nop,nop,TS val 4185020632 ecr 413336616], length 0
17:40:21.092153 IP 192.168.122.239.9801 > 192.168.122.1.60367: Flags [.], ack 3691989359, win 1446, options [nop,nop,TS val 4185020632 ecr 413336616,nop,nop,sack 1 {3691990807:3691996599}], length 0
17:40:21.092174 IP 192.168.122.239.9801 > 192.168.122.1.60367: Flags [.], ack 3691996599, win 1430, options [nop,nop,TS val 4185020632 ecr 413336616], length 0
17:40:21.092179 IP 192.168.122.239.9801 > 192.168.122.1.60367: Flags [.], ack 3691998047, win 1422, options [nop,nop,TS val 4185020632 ecr 413336616], length 0
17:40:21.092410 IP 192.168.122.1.60368 > 192.168.122.239.9801: Flags [P.], seq 454571719:454577511, ack 806152299, win 229, options [nop,nop,TS val 413336616 ecr 4185020632], length 5792
17:40:21.092456 IP 192.168.122.1.60367 > 192.168.122.239.9801: Flags [.], seq 3691998047:3692000943, ack 300954310, win 229, options [nop,nop,TS val 413336616 ecr 4185020632], length 2896
17:40:21.092501 IP 192.168.122.1.60367 > 192.168.122.239.9801: Flags [.], seq 3692000943:3692003839, ack 300954310, win 229, options [nop,nop,TS val 413336616 ecr 4185020632], length 2896
17:40:21.092541 IP 192.168.122.239.9801 > 192.168.122.1.60368: Flags [.], ack 454577511, win 1452, options [nop,nop,TS val 4185020632 ecr 413336616], length 0
17:40:21.092590 IP 192.168.122.239.9801 > 192.168.122.1.60367: Flags [.], ack 3692000943, win 1452, options [nop,nop,TS val 4185020632 ecr 413336616], length 0
17:40:21.092607 IP 192.168.122.239.9801 > 192.168.122.1.60367: Flags [.], ack 3692003839, win 1452, options [nop,nop,TS val 4185020632 ecr 413336616], length 0
17:40:21.092760 IP 192.168.122.1.60367 > 192.168.122.239.9801: Flags [.], seq 3692003839:3692006735, ack 300954310, win 229, options [nop,nop,TS val 413336616 ecr 4185020632], length 2896
17:40:21.092818 IP 192.168.122.1.60367 > 192.168.122.239.9801: Flags [P.], seq 3692006735:3692009631, ack 300954310, win 229, options [nop,nop,TS val 413336616 ecr 4185020632], length 2896
17:40:21.092899 IP 192.168.122.239.9801 > 192.168.122.1.60367: Flags [.], ack 3692006735, win 1452, options [nop,nop,TS val 4185020632 ecr 413336616], length 0
17:40:21.092936 IP 192.168.122.239.9801 > 192.168.122.1.60367: Flags [.], ack 3692009631, win 1452, options [nop,nop,TS val 4185020632 ecr 413336616], length 0
17:40:21.093078 IP 192.168.122.1.60367 > 192.168.122.239.9801: Flags [.], seq 3692009631:3692012527, ack 300954310, win 229, options [nop,nop,TS val 413336616 ecr 4185020632], length 2896
17:40:21.093135 IP 192.168.122.1.60367 > 192.168.122.239.9801: Flags [.], seq 3692012527:3692015423, ack 300954310, win 229, options [nop,nop,TS val 413336616 ecr 4185020632], length 2896
17:40:21.093183 IP 192.168.122.239.9801 > 192.168.122.1.60367: Flags [.], ack 3692012527, win 1452, options [nop,nop,TS val 4185020632 ecr 413336616], length 0
17:40:21.093208 IP 192.168.122.239.9801 > 192.168.122.1.60367: Flags [.], ack 3692015423, win 1452, options [nop,nop,TS val 4185020632 ecr 413336616], length 0
17:40:21.093347 IP 192.168.122.1.60367 > 192.168.122.239.9801: Flags [.], seq 3692015423:3692018319, ack 300954310, win 229, options [nop,nop,TS val 413336616 ecr 4185020632], length 2896
17:40:21.093404 IP 192.168.122.1.60367 > 192.168.122.239.9801: Flags [.], seq 3692018319:3692021215, ack 300954310, win 229, options [nop,nop,TS val 413336616 ecr 4185020632], length 2896
17:40:21.093448 IP 192.168.122.239.9801 > 192.168.122.1.60367: Flags [.], ack 3692018319, win 1452, options [nop,nop,TS val 4185020632 ecr 413336616], length 0
17:40:21.093528 IP 192.168.122.239.9801 > 192.168.122.1.60367: Flags [.], ack 3692021215, win 1452, options [nop,nop,TS val 4185020632 ecr 413336616], length 0
17:40:21.093650 IP 192.168.122.1.60367 > 192.168.122.239.9801: Flags [.], seq 3692021215:3692024111, ack 300954310, win 229, options [nop,nop,TS val 413336616 ecr 4185020632], length 2896
17:40:21.093730 IP 192.168.122.1.60367 > 192.168.122.239.9801: Flags [.], seq 3692024111:3692027007, ack 300954310, win 229, options [nop,nop,TS val 413336616 ecr 4185020632], length 2896
17:40:21.093830 IP 192.168.122.239.9801 > 192.168.122.1.60367: Flags [.], ack 3692024111, win 1452, options [nop,nop,TS val 4185020632 ecr 413336616], length 0
17:40:21.093867 IP 192.168.122.239.9801 > 192.168.122.1.60367: Flags [.], ack 3692027007, win 1452, options [nop,nop,TS val 4185020632 ecr 413336616], length 0
17:40:21.094003 IP 192.168.122.1.60367 > 192.168.122.239.9801: Flags [.], seq 3692027007:3692029903, ack 300954310, win 229, options [nop,nop,TS val 413336617 ecr 4185020632], length 2896
17:40:21.094050 IP 192.168.122.1.60367 > 192.168.122.239.9801: Flags [.], seq 3692029903:3692032799, ack 300954310, win 229, options [nop,nop,TS val 413336617 ecr 4185020632], length 2896
17:40:21.094150 IP 192.168.122.239.9801 > 192.168.122.1.60367: Flags [.], ack 3692029903, win 1452, options [nop,nop,TS val 4185020632 ecr 413336617], length 0
17:40:21.094182 IP 192.168.122.239.9801 > 192.168.122.1.60367: Flags [.], ack 3692032799, win 1452, options [nop,nop,TS val 4185020632 ecr 413336617], length 0
17:40:21.094277 IP 192.168.122.1.60367 > 192.168.122.239.9801: Flags [.], seq 3692032799:3692035695, ack 300954310, win 229, options [nop,nop,TS val 413336617 ecr 4185020632], length 2896
17:40:21.094312 IP 192.168.122.1.60367 > 192.168.122.239.9801: Flags [.], seq 3692035695:3692038591, ack 300954310, win 229, options [nop,nop,TS val 413336617 ecr 4185020632], length 2896
17:40:21.094412 IP 192.168.122.239.9801 > 192.168.122.1.60367: Flags [.], ack 3692035695, win 1452, options [nop,nop,TS val 4185020632 ecr 413336617], length 0
17:40:21.094443 IP 192.168.122.239.9801 > 192.168.122.1.60367: Flags [.], ack 3692038591, win 1452, options [nop,nop,TS val 4185020632 ecr 413336617], length 0
17:40:21.094538 IP 192.168.122.1.60367 > 192.168.122.239.9801: Flags [.], seq 3692038591:3692041487, ack 300954310, win 229, options [nop,nop,TS val 413336617 ecr 4185020632], length 2896
17:40:21.094581 IP 192.168.122.1.60367 > 192.168.122.239.9801: Flags [.], seq 3692041487:3692044383, ack 300954310, win 229, options [nop,nop,TS val 413336617 ecr 4185020632], length 2896
17:40:21.095011 IP 192.168.122.239.9801 > 192.168.122.1.60367: Flags [.], ack 3692041487, win 1452, options [nop,nop,TS val 4185020632 ecr 413336617], length 0
17:40:21.095045 IP 192.168.122.239.9801 > 192.168.122.1.60367: Flags [.], ack 3692044383, win 1452, options [nop,nop,TS val 4185020632 ecr 413336617], length 0
17:40:21.095134 IP 192.168.122.1.60367 > 192.168.122.239.9801: Flags [.], seq 3692044383:3692047279, ack 300954310, win 229, options [nop,nop,TS val 413336617 ecr 4185020632], length 2896
17:40:21.095193 IP 192.168.122.1.60367 > 192.168.122.239.9801: Flags [P.], seq 3692047279:3692050175, ack 300954310, win 229, options [nop,nop,TS val 413336617 ecr 4185020632], length 2896
17:40:21.095297 IP 192.168.122.239.9801 > 192.168.122.1.60367: Flags [.], ack 3692047279, win 1452, options [nop,nop,TS val 4185020633 ecr 413336617], length 0
17:40:21.095332 IP 192.168.122.239.9801 > 192.168.122.1.60367: Flags [.], ack 3692050175, win 1452, options [nop,nop,TS val 4185020633 ecr 413336617], length 0
17:40:21.095452 IP 192.168.122.1.60367 > 192.168.122.239.9801: Flags [.], seq 3692050175:3692053071, ack 300954310, win 229, options [nop,nop,TS val 413336617 ecr 4185020633], length 2896
17:40:21.095554 IP 192.168.122.1.60367 > 192.168.122.239.9801: Flags [.], seq 3692053071:3692055967, ack 300954310, win 229, options [nop,nop,TS val 413336617 ecr 4185020633], length 2896
17:40:21.095628 IP 192.168.122.239.9801 > 192.168.122.1.60367: Flags [.], ack 3692053071, win 1452, options [nop,nop,TS val 4185020633 ecr 413336617], length 0
17:40:21.095662 IP 192.168.122.239.9801 > 192.168.122.1.60367: Flags [.], ack 3692055967, win 1452, options [nop,nop,TS val 4185020633 ecr 413336617], length 0
17:40:21.095759 IP 192.168.122.1.60367 > 192.168.122.239.9801: Flags [.], seq 3692055967:3692058863, ack 300954310, win 229, options [nop,nop,TS val 413336617 ecr 4185020633], length 2896
17:40:21.095810 IP 192.168.122.1.60367 > 192.168.122.239.9801: Flags [.], seq 3692058863:3692061759, ack 300954310, win 229, options [nop,nop,TS val 413336617 ecr 4185020633], length 2896
17:40:21.095911 IP 192.168.122.239.9801 > 192.168.122.1.60367: Flags [.], ack 3692058863, win 1452, options [nop,nop,TS val 4185020633 ecr 413336617], length 0
17:40:21.095945 IP 192.168.122.239.9801 > 192.168.122.1.60367: Flags [.], ack 3692061759, win 1452, options [nop,nop,TS val 4185020633 ecr 413336617], length 0
17:40:21.096032 IP 192.168.122.1.60367 > 192.168.122.239.9801: Flags [.], seq 3692061759:3692064655, ack 300954310, win 229, options [nop,nop,TS val 413336617 ecr 4185020633], length 2896
17:40:21.096081 IP 192.168.122.1.60367 > 192.168.122.239.9801: Flags [.], seq 3692064655:3692067551, ack 300954310, win 229, options [nop,nop,TS val 413336617 ecr 4185020633], length 2896
17:40:21.096182 IP 192.168.122.239.9801 > 192.168.122.1.60367: Flags [.], ack 3692064655, win 1452, options [nop,nop,TS val 4185020633 ecr 413336617], length 0
17:40:21.096214 IP 192.168.122.239.9801 > 192.168.122.1.60367: Flags [.], ack 3692067551, win 1452, options [nop,nop,TS val 4185020633 ecr 413336617], length 0
17:40:21.096316 IP 192.168.122.1.60367 > 192.168.122.239.9801: Flags [.], seq 3692067551:3692070447, ack 300954310, win 229, options [nop,nop,TS val 413336617 ecr 4185020633], length 2896
17:40:21.096370 IP 192.168.122.1.60367 > 192.168.122.239.9801: Flags [.], seq 3692070447:3692073343, ack 300954310, win 229, options [nop,nop,TS val 413336617 ecr 4185020633], length 2896
17:40:21.096425 IP 192.168.122.239.9801 > 192.168.122.1.60367: Flags [.], ack 3692070447, win 1452, options [nop,nop,TS val 4185020633 ecr 413336617], length 0
17:40:21.096451 IP 192.168.122.239.9801 > 192.168.122.1.60367: Flags [.], ack 3692073343, win 1452, options [nop,nop,TS val 4185020633 ecr 413336617], length 0
17:40:21.096562 IP 192.168.122.1.60367 > 192.168.122.239.9801: Flags [.], seq 3692073343:3692076239, ack 300954310, win 229, options [nop,nop,TS val 413336617 ecr 4185020633], length 2896
17:40:21.096624 IP 192.168.122.1.60367 > 192.168.122.239.9801: Flags [.], seq 3692076239:3692079135, ack 300954310, win 229, options [nop,nop,TS val 413336617 ecr 4185020633], length 2896
17:40:21.096677 IP 192.168.122.239.9801 > 192.168.122.1.60367: Flags [.], ack 3692076239, win 1452, options [nop,nop,TS val 4185020633 ecr 413336617], length 0
17:40:21.096702 IP 192.168.122.239.9801 > 192.168.122.1.60367: Flags [.], ack 3692079135, win 1452, options [nop,nop,TS val 4185020633 ecr 413336617], length 0
17:40:21.096791 IP 192.168.122.1.60367 > 192.168.122.239.9801: Flags [.], seq 3692079135:3692082031, ack 300954310, win 229, options [nop,nop,TS val 413336617 ecr 4185020633], length 2896
17:40:21.096842 IP 192.168.122.1.60367 > 192.168.122.239.9801: Flags [P.], seq 3692082031:3692084927, ack 300954310, win 229, options [nop,nop,TS val 413336617 ecr 4185020633], length 2896
17:40:21.096895 IP 192.168.122.239.9801 > 192.168.122.1.60367: Flags [.], ack 3692082031, win 1452, options [nop,nop,TS val 4185020633 ecr 413336617], length 0
17:40:21.096918 IP 192.168.122.239.9801 > 192.168.122.1.60367: Flags [.], ack 3692084927, win 1452, options [nop,nop,TS val 4185020633 ecr 413336617], length 0
17:40:21.097006 IP 192.168.122.1.60367 > 192.168.122.239.9801: Flags [.], seq 3692084927:3692087823, ack 300954310, win 229, options [nop,nop,TS val 413336617 ecr 4185020633], length 2896
17:40:21.097057 IP 192.168.122.1.60367 > 192.168.122.239.9801: Flags [.], seq 3692087823:3692090719, ack 300954310, win 229, options [nop,nop,TS val 413336617 ecr 4185020633], length 2896
17:40:21.097111 IP 192.168.122.239.9801 > 192.168.122.1.60367: Flags [.], ack 3692087823, win 1452, options [nop,nop,TS val 4185020633 ecr 413336617], length 0
17:40:21.097133 IP 192.168.122.239.9801 > 192.168.122.1.60367: Flags [.], ack 3692090719, win 1452, options [nop,nop,TS val 4185020633 ecr 413336617], length 0
