17:45:45.721410 IP 192.168.122.1.60373 > 192.168.122.239.9801: Flags [S], seq 1711162499, win 29200, options [mss 1460,sackOK,TS val 413417773 ecr 0,nop,wscale 7], length 0
17:45:45.721468 IP 192.168.122.1.60374 > 192.168.122.239.9801: Flags [S], seq 1751359615, win 29200, options [mss 1460,sackOK,TS val 413417773 ecr 0,nop,wscale 7], length 0
17:45:45.731487 IP 192.168.122.239.9801 > 192.168.122.1.60373: Flags [S.], seq 1773965767, ack 1711162500, win 28960, options [mss 1460,sackOK,TS val 4185101789 ecr 413417773,nop,wscale 7], length 0
17:45:45.731499 IP 192.168.122.239.9801 > 192.168.122.1.60374: Flags [S.], seq 3274801825, ack 1751359616, win 28960, options [mss 1460,sackOK,TS val 4185101789 ecr 413417773,nop,wscale 7], length 0
17:45:45.731581 IP 192.168.122.1.60373 > 192.168.122.239.9801: Flags [.], ack 1773965768, win 229, options [nop,nop,TS val 413417776 ecr 4185101789], length 0
17:45:45.731613 IP 192.168.122.1.60374 > 192.168.122.239.9801: Flags [.], ack 3274801826, win 229, options [nop,nop,TS val 413417776 ecr 4185101789], length 0
17:45:45.731619 IP 192.168.122.1.60373 > 192.168.122.239.9801: Flags [P.], seq 1711162500:1711162524, ack 1773965768, win 229, options [nop,nop,TS val 413417776 ecr 4185101789], length 24
17:45:45.731635 IP 192.168.122.1.60374 > 192.168.122.239.9801: Flags [P.], seq 1751359616:1751359640, ack 3274801826, win 229, options [nop,nop,TS val 413417776 ecr 4185101789], length 24
17:45:45.731639 IP 192.168.122.1.60374 > 192.168.122.239.9801: Flags [.], seq 1751359640:1751362536, ack 3274801826, win 229, options [nop,nop,TS val 413417776 ecr 4185101789], length 2896
17:45:45.731644 IP 192.168.122.1.60374 > 192.168.122.239.9801: Flags [.], seq 1751362536:1751365432, ack 3274801826, win 229, options [nop,nop,TS val 413417776 ecr 4185101789], length 2896
17:45:45.731647 IP 192.168.122.1.60374 > 192.168.122.239.9801: Flags [.], seq 1751365432:1751368328, ack 3274801826, win 229, options [nop,nop,TS val 413417776 ecr 4185101789], length 2896
17:45:45.731650 IP 192.168.122.1.60374 > 192.168.122.239.9801: Flags [.], seq 1751368328:1751371224, ack 3274801826, win 229, options [nop,nop,TS val 413417776 ecr 4185101789], length 2896
17:45:45.731652 IP 192.168.122.1.60373 > 192.168.122.239.9801: Flags [.], seq 1711162524:1711165420, ack 1773965768, win 229, options [nop,nop,TS val 413417776 ecr 4185101789], length 2896
17:45:45.731654 IP 192.168.122.1.60373 > 192.168.122.239.9801: Flags [.], seq 1711165420:1711168316, ack 1773965768, win 229, options [nop,nop,TS val 413417776 ecr 4185101789], length 2896
17:45:45.731657 IP 192.168.122.1.60373 > 192.168.122.239.9801: Flags [.], seq 1711168316:1711171212, ack 1773965768, win 229, options [nop,nop,TS val 413417776 ecr 4185101789], length 2896
17:45:45.731677 IP 192.168.122.1.60374 > 192.168.122.239.9801: Flags [.], seq 1751371224:1751372672, ack 3274801826, win 229, options [nop,nop,TS val 413417776 ecr 4185101789], length 1448
17:45:45.731680 IP 192.168.122.1.60373 > 192.168.122.239.9801: Flags [.], seq 1711174108:1711175556, ack 1773965768, win 229, options [nop,nop,TS val 413417776 ecr 4185101789], length 1448
17:45:45.741675 IP 192.168.122.239.9801 > 192.168.122.1.60373: Flags [.], ack 1711162524, win 227, options [nop,nop,TS val 4185101792 ecr 413417776], length 0
17:45:45.741682 IP 192.168.122.239.9801 > 192.168.122.1.60374: Flags [.], ack 1751359640, win 227, options [nop,nop,TS val 4185101792 ecr 413417776], length 0
17:45:45.741683 IP 192.168.122.239.9801 > 192.168.122.1.60374: Flags [.], ack 1751362536, win 272, options [nop,nop,TS val 4185101792 ecr 413417776], length 0
17:45:45.741684 IP 192.168.122.239.9801 > 192.168.122.1.60374: Flags [.], ack 1751365432, win 317, options [nop,nop,TS val 4185101792 ecr 413417776], length 0
17:45:45.741685 IP 192.168.122.239.9801 > 192.168.122.1.60374: Flags [.], ack 1751368328, win 362, options [nop,nop,TS val 4185101792 ecr 413417776], length 0
17:45:45.741685 IP 192.168.122.239.9801 > 192.168.122.1.60374: Flags [.], ack 1751371224, win 408, options [nop,nop,TS val 4185101792 ecr 413417776], length 0
17:45:45.741686 IP 192.168.122.239.9801 > 192.168.122.1.60373: Flags [.], ack 1711162524, win 272, options [nop,nop,TS val 4185101792 ecr 413417776,nop,nop,sack 1 {1711165420:1711168316}], length 0
17:45:45.741686 IP 192.168.122.239.9801 > 192.168.122.1.60373: Flags [.], ack 1711162524, win 317, options [nop,nop,TS val 4185101792 ecr 413417776,nop,nop,sack 1 {1711165420:1711171212}], length 0
17:45:45.741687 IP 192.168.122.239.9801 > 192.168.122.1.60374: Flags [.], ack 1751372672, win 430, options [nop,nop,TS val 4185101792 ecr 413417776], length 0
17:45:45.741688 IP 192.168.122.239.9801 > 192.168.122.1.60373: Flags [.], ack 1711162524, win 340, options [nop,nop,TS val 4185101792 ecr 413417776,nop,nop,sack 2 {1711174108:1711175556}{1711165420:1711171212}], length 0
17:45:45.741766 IP 192.168.122.1.60374 > 192.168.122.239.9801: Flags [P.], seq 1751372672:1751375568, ack 3274801826, win 229, options [nop,nop,TS val 413417779 ecr 4185101792], length 2896
17:45:45.741786 IP 192.168.122.1.60374 > 192.168.122.239.9801: Flags [.], seq 1751375568:1751378464, ack 3274801826, win 229, options [nop,nop,TS val 413417779 ecr 4185101792], length 2896
17:45:45.741788 IP 192.168.122.1.60374 > 192.168.122.239.9801: Flags [.], seq 1751378464:1751381360, ack 3274801826, win 229, options [nop,nop,TS val 413417779 ecr 4185101792], length 2896
17:45:45.741790 IP 192.168.122.1.60374 > 192.168.122.239.9801: Flags [.], seq 1751381360:1751384256, ack 3274801826, win 229, options [nop,nop,TS val 413417779 ecr 4185101792], length 2896
17:45:45.741793 IP 192.168.122.1.60373 > 192.168.122.239.9801: Flags [.], seq 1711162524:1711165420, ack 1773965768, win 229, options [nop,nop,TS val 413417779 ecr 4185101792], length 2896
17:45:45.741796 IP 192.168.122.1.60373 > 192.168.122.239.9801: Flags [P.], seq 1711175556:1711178452, ack 1773965768, win 229, options [nop,nop,TS val 413417779 ecr 4185101792], length 2896
17:45:45.741798 IP 192.168.122.1.60374 > 192.168.122.239.9801: Flags [.], seq 1751384256:1751387152, ack 3274801826, win 229, options [nop,nop,TS val 413417779 ecr 4185101792], length 2896
17:45:45.741799 IP 192.168.122.1.60373 > 192.168.122.239.9801: Flags [.], seq 1711178452:1711179900, ack 1773965768, win 229, options [nop,nop,TS val 413417779 ecr 4185101792], length 1448
17:45:45.751862 IP 192.168.122.239.9801 > 192.168.122.1.60374: Flags [.], ack 1751375568, win 476, options [nop,nop,TS val 4185101794 ecr 413417779], length 0
17:45:45.751872 IP 192.168.122.239.9801 > 192.168.122.1.60374: Flags [.], ack 1751378464, win 521, options [nop,nop,TS val 4185101794 ecr 413417779], length 0
17:45:45.751873 IP 192.168.122.239.9801 > 192.168.122.1.60373: Flags [.], ack 1711171212, win 385, options [nop,nop,TS val 4185101794 ecr 413417779,nop,nop,sack 1 {1711174108:1711175556}], length 0
17:45:45.751874 IP 192.168.122.239.9801 > 192.168.122.1.60374: Flags [.], ack 1751381360, win 566, options [nop,nop,TS val 4185101794 ecr 413417779], length 0
17:45:45.751875 IP 192.168.122.239.9801 > 192.168.122.1.60373: Flags [.], ack 1711171212, win 430, options [nop,nop,TS val 4185101794 ecr 413417779,nop,nop,sack 1 {1711174108:1711178452}], length 0
17:45:45.751875 IP 192.168.122.239.9801 > 192.168.122.1.60374: Flags [.], ack 1751384256, win 611, options [nop,nop,TS val 4185101794 ecr 413417779], length 0
17:45:45.751876 IP 192.168.122.239.9801 > 192.168.122.1.60374: Flags [.], ack 1751387152, win 657, options [nop,nop,TS val 4185101794 ecr 413417779], length 0
17:45:45.751956 IP 192.168.122.1.60374 > 192.168.122.239.9801: Flags [.], seq 1751387152:1751390048, ack 3274801826, win 229, options [nop,nop,TS val 413417781 ecr 4185101794], length 2896
17:45:45.751974 IP 192.168.122.1.60374 > 192.168.122.239.9801: Flags [P.], seq 1751390048:1751392944, ack 3274801826, win 229, options [nop,nop,TS val 413417781 ecr 4185101794], length 2896
17:45:45.751978 IP 192.168.122.1.60374 > 192.168.122.239.9801: Flags [.], seq 1751392944:1751395840, ack 3274801826, win 229, options [nop,nop,TS val 413417781 ecr 4185101794], length 2896
17:45:45.751980 IP 192.168.122.1.60373 > 192.168.122.239.9801: Flags [.], seq 1711179900:1711182796, ack 1773965768, win 229, options [nop,nop,TS val 413417781 ecr 4185101794], length 2896
17:45:45.751985 IP 192.168.122.1.60373 > 192.168.122.239.9801: Flags [.], seq 1711171212:1711174108, ack 1773965768, win 229, options [nop,nop,TS val 413417781 ecr 4185101794], length 2896
17:45:45.751986 IP 192.168.122.1.60374 > 192.168.122.239.9801: Flags [.], seq 1751395840:1751398736, ack 3274801826, win 229, options [nop,nop,TS val 413417781 ecr 4185101794], length 2896
17:45:45.751988 IP 192.168.122.1.60374 > 192.168.122.239.9801: Flags [.], seq 1751398736:1751401632, ack 3274801826, win 229, options [nop,nop,TS val 413417781 ecr 4185101794], length 2896
17:45:45.751989 IP 192.168.122.1.60373 > 192.168.122.239.9801: Flags [.], seq 1711182796:1711184244, ack 1773965768, win 229, options [nop,nop,TS val 413417781 ecr 4185101794], length 1448
17:45:45.762055 IP 192.168.122.239.9801 > 192.168.122.1.60374: Flags [.], ack 1751390048, win 702, options [nop,nop,TS val 4185101797 ecr 413417781], length 0
17:45:45.762067 IP 192.168.122.239.9801 > 192.168.122.1.60373: Flags [.], ack 1711171212, win 476, options [nop,nop,TS val 4185101797 ecr 413417779,nop,nop,sack 2 {1711179900:1711182796}{1711174108:1711178452}], length 0
17:45:45.762068 IP 192.168.122.239.9801 > 192.168.122.1.60374: Flags [.], ack 1751392944, win 747, options [nop,nop,TS val 4185101797 ecr 413417781], length 0
17:45:45.762069 IP 192.168.122.239.9801 > 192.168.122.1.60374: Flags [.], ack 1751395840, win 792, options [nop,nop,TS val 4185101797 ecr 413417781], length 0
17:45:45.762070 IP 192.168.122.239.9801 > 192.168.122.1.60373: Flags [.], ack 1711178452, win 521, options [nop,nop,TS val 4185101797 ecr 413417781,nop,nop,sack 1 {1711179900:1711182796}], length 0
17:45:45.762071 IP 192.168.122.239.9801 > 192.168.122.1.60373: Flags [.], ack 1711178452, win 543, options [nop,nop,TS val 4185101797 ecr 413417781,nop,nop,sack 1 {1711179900:1711184244}], length 0
17:45:45.762071 IP 192.168.122.239.9801 > 192.168.122.1.60374: Flags [.], ack 1751398736, win 838, options [nop,nop,TS val 4185101797 ecr 413417781], length 0
17:45:45.762072 IP 192.168.122.239.9801 > 192.168.122.1.60374: Flags [.], ack 1751401632, win 883, options [nop,nop,TS val 4185101797 ecr 413417781], length 0
17:45:45.762168 IP 192.168.122.1.60374 > 192.168.122.239.9801: Flags [.], seq 1751401632:1751404528, ack 3274801826, win 229, options [nop,nop,TS val 413417784 ecr 4185101797], length 2896
17:45:45.762186 IP 192.168.122.1.60373 > 192.168.122.239.9801: Flags [.], seq 1711184244:1711187140, ack 1773965768, win 229, options [nop,nop,TS val 413417784 ecr 4185101797], length 2896
17:45:45.762191 IP 192.168.122.1.60374 > 192.168.122.239.9801: Flags [.], seq 1751404528:1751407424, ack 3274801826, win 229, options [nop,nop,TS val 413417784 ecr 4185101797], length 2896
17:45:45.762195 IP 192.168.122.1.60373 > 192.168.122.239.9801: Flags [.], seq 1711187140:1711191484, ack 1773965768, win 229, options [nop,nop,TS val 413417784 ecr 4185101797], length 4344
17:45:45.762197 IP 192.168.122.1.60374 > 192.168.122.239.9801: Flags [.], seq 1751410320:1751413216, ack 3274801826, win 229, options [nop,nop,TS val 413417784 ecr 4185101797], length 2896
17:45:45.762200 IP 192.168.122.1.60374 > 192.168.122.239.9801: Flags [.], seq 1751413216:1751416112, ack 3274801826, win 229, options [nop,nop,TS val 413417784 ecr 4185101797], length 2896
17:45:45.762201 IP 192.168.122.1.60373 > 192.168.122.239.9801: Flags [.], seq 1711178452:1711179900, ack 1773965768, win 229, options [nop,nop,TS val 413417784 ecr 4185101797], length 1448
17:45:45.772233 IP 192.168.122.239.9801 > 192.168.122.1.60374: Flags [.], ack 1751404528, win 928, options [nop,nop,TS val 4185101799 ecr 413417784], length 0
17:45:45.772244 IP 192.168.122.239.9801 > 192.168.122.1.60373: Flags [.], ack 1711178452, win 589, options [nop,nop,TS val 4185101799 ecr 413417781,nop,nop,sack 1 {1711179900:1711187140}], length 0
17:45:45.772245 IP 192.168.122.239.9801 > 192.168.122.1.60374: Flags [.], ack 1751407424, win 973, options [nop,nop,TS val 4185101799 ecr 413417784], length 0
17:45:45.772246 IP 192.168.122.239.9801 > 192.168.122.1.60373: Flags [.], ack 1711187140, win 611, options [nop,nop,TS val 4185101799 ecr 413417784], length 0
17:45:45.772246 IP 192.168.122.239.9801 > 192.168.122.1.60374: Flags [.], ack 1751407424, win 1019, options [nop,nop,TS val 4185101799 ecr 413417784,nop,nop,sack 1 {1751410320:1751413216}], length 0
17:45:45.772247 IP 192.168.122.239.9801 > 192.168.122.1.60374: Flags [.], ack 1751407424, win 1064, options [nop,nop,TS val 4185101799 ecr 413417784,nop,nop,sack 1 {1751410320:1751416112}], length 0
17:45:45.772362 IP 192.168.122.1.60374 > 192.168.122.239.9801: Flags [.], seq 1751416112:1751419008, ack 3274801826, win 229, options [nop,nop,TS val 413417786 ecr 4185101799], length 2896
17:45:45.772380 IP 192.168.122.1.60374 > 192.168.122.239.9801: Flags [.], seq 1751419008:1751421904, ack 3274801826, win 229, options [nop,nop,TS val 413417786 ecr 4185101799], length 2896
17:45:45.772384 IP 192.168.122.1.60374 > 192.168.122.239.9801: Flags [P.], seq 1751407424:1751410320, ack 3274801826, win 229, options [nop,nop,TS val 413417786 ecr 4185101799], length 2896
17:45:45.772386 IP 192.168.122.1.60373 > 192.168.122.239.9801: Flags [.], seq 1711191484:1711192932, ack 1773965768, win 229, options [nop,nop,TS val 413417786 ecr 4185101799], length 1448
17:45:45.772388 IP 192.168.122.1.60374 > 192.168.122.239.9801: Flags [.], seq 1751421904:1751423352, ack 3274801826, win 229, options [nop,nop,TS val 413417786 ecr 4185101799], length 1448
17:45:45.782416 IP 192.168.122.239.9801 > 192.168.122.1.60373: Flags [.], ack 1711187140, win 634, options [nop,nop,TS val 4185101802 ecr 413417784,nop,nop,sack 1 {1711191484:1711192932}], length 0
17:45:45.782424 IP 192.168.122.239.9801 > 192.168.122.1.60374: Flags [.], ack 1751407424, win 1109, options [nop,nop,TS val 4185101802 ecr 413417784,nop,nop,sack 1 {1751410320:1751419008}], length 0
17:45:45.782425 IP 192.168.122.239.9801 > 192.168.122.1.60374: Flags [.], ack 1751407424, win 1154, options [nop,nop,TS val 4185101802 ecr 413417784,nop,nop,sack 1 {1751410320:1751421904}], length 0
17:45:45.782426 IP 192.168.122.239.9801 > 192.168.122.1.60374: Flags [.], ack 1751421904, win 1200, options [nop,nop,TS val 4185101802 ecr 413417786], length 0
17:45:45.782427 IP 192.168.122.239.9801 > 192.168.122.1.60374: Flags [.], ack 1751423352, win 1222, options [nop,nop,TS val 4185101802 ecr 413417786], length 0
17:45:45.782527 IP 192.168.122.1.60373 > 192.168.122.239.9801: Flags [.], seq 1711187140:1711188588, ack 1773965768, win 229, options [nop,nop,TS val 413417789 ecr 4185101802], length 1448
17:45:45.782533 IP 192.168.122.1.60374 > 192.168.122.239.9801: Flags [P.], seq 1751423352:1751424800, ack 3274801826, win 229, options [nop,nop,TS val 413417789 ecr 4185101802], length 1448
17:45:45.782547 IP 192.168.122.1.60374 > 192.168.122.239.9801: Flags [.], seq 1751424800:1751430592, ack 3274801826, win 229, options [nop,nop,TS val 413417789 ecr 4185101802], length 5792
17:45:45.782549 IP 192.168.122.1.60374 > 192.168.122.239.9801: Flags [.], seq 1751430592:1751433488, ack 3274801826, win 229, options [nop,nop,TS val 413417789 ecr 4185101802], length 2896
17:45:45.782550 IP 192.168.122.1.60373 > 192.168.122.239.9801: Flags [.], seq 1711192932:1711194380, ack 1773965768, win 229, options [nop,nop,TS val 413417789 ecr 4185101802], length 1448
17:45:45.792577 IP 192.168.122.239.9801 > 192.168.122.1.60373: Flags [.], ack 1711188588, win 657, options [nop,nop,TS val 4185101804 ecr 413417789,nop,nop,sack 1 {1711191484:1711192932}], length 0
17:45:45.792584 IP 192.168.122.239.9801 > 192.168.122.1.60374: Flags [.], ack 1751424800, win 1245, options [nop,nop,TS val 4185101804 ecr 413417789], length 0
17:45:45.792585 IP 192.168.122.239.9801 > 192.168.122.1.60373: Flags [.], ack 1711188588, win 679, options [nop,nop,TS val 4185101804 ecr 413417789,nop,nop,sack 1 {1711191484:1711194380}], length 0
17:45:45.792586 IP 192.168.122.239.9801 > 192.168.122.1.60374: Flags [.], ack 1751430592, win 1335, options [nop,nop,TS val 4185101804 ecr 413417789], length 0
17:45:45.792679 IP 192.168.122.1.60373 > 192.168.122.239.9801: Flags [P.], seq 1711194380:1711195828, ack 1773965768, win 229, options [nop,nop,TS val 413417791 ecr 4185101804], length 1448
17:45:45.792685 IP 192.168.122.1.60374 > 192.168.122.239.9801: Flags [.], seq 1751433488:1751436384, ack 3274801826, win 229, options [nop,nop,TS val 413417791 ecr 4185101804], length 2896
17:45:45.792700 IP 192.168.122.1.60373 > 192.168.122.239.9801: Flags [.], seq 1711188588:1711190036, ack 1773965768, win 229, options [nop,nop,TS val 413417791 ecr 4185101804], length 1448
17:45:45.792702 IP 192.168.122.1.60374 > 192.168.122.239.9801: Flags [.], seq 1751436384:1751439280, ack 3274801826, win 229, options [nop,nop,TS val 413417791 ecr 4185101804], length 2896
17:45:45.792703 IP 192.168.122.1.60374 > 192.168.122.239.9801: Flags [.], seq 1751439280:1751442176, ack 3274801826, win 229, options [nop,nop,TS val 413417791 ecr 4185101804], length 2896
17:45:45.792704 IP 192.168.122.1.60373 > 192.168.122.239.9801: Flags [.], seq 1711195828:1711197276, ack 1773965768, win 229, options [nop,nop,TS val 413417791 ecr 4185101804], length 1448
17:45:45.802740 IP 192.168.122.239.9801 > 192.168.122.1.60373: Flags [.], ack 1711188588, win 702, options [nop,nop,TS val 4185101807 ecr 413417789,nop,nop,sack 1 {1711191484:1711195828}], length 0
17:45:45.802749 IP 192.168.122.239.9801 > 192.168.122.1.60373: Flags [.], ack 1711190036, win 724, options [nop,nop,TS val 4185101807 ecr 413417791,nop,nop,sack 1 {1711191484:1711195828}], length 0
17:45:45.802751 IP 192.168.122.239.9801 > 192.168.122.1.60373: Flags [.], ack 1711190036, win 747, options [nop,nop,TS val 4185101807 ecr 413417791,nop,nop,sack 1 {1711191484:1711197276}], length 0
17:45:45.802752 IP 192.168.122.239.9801 > 192.168.122.1.60374: Flags [.], ack 1751430592, win 1381, options [nop,nop,TS val 4185101807 ecr 413417789,nop,nop,sack 1 {1751433488:1751436384}], length 0
17:45:45.802753 IP 192.168.122.239.9801 > 192.168.122.1.60374: Flags [.], ack 1751430592, win 1426, options [nop,nop,TS val 4185101807 ecr 413417789,nop,nop,sack 1 {1751433488:1751439280}], length 0
17:45:45.802754 IP 192.168.122.239.9801 > 192.168.122.1.60374: Flags [.], ack 1751430592, win 1426, options [nop,nop,TS val 4185101807 ecr 413417789,nop,nop,sack 1 {1751433488:1751442176}], length 0
17:45:45.802816 IP 192.168.122.1.60373 > 192.168.122.239.9801: Flags [.], seq 1711190036:1711191484, ack 1773965768, win 229, options [nop,nop,TS val 413417794 ecr 4185101807], length 1448
17:45:45.802825 IP 192.168.122.1.60374 > 192.168.122.239.9801: Flags [.], seq 1751430592:1751433488, ack 3274801826, win 229, options [nop,nop,TS val 413417794 ecr 4185101807], length 2896
17:45:45.802829 IP 192.168.122.1.60373 > 192.168.122.239.9801: Flags [.], seq 1711197276:1711201620, ack 1773965768, win 229, options [nop,nop,TS val 413417794 ecr 4185101807], length 4344
17:45:45.802830 IP 192.168.122.1.60374 > 192.168.122.239.9801: Flags [.], seq 1751442176:1751446520, ack 3274801826, win 229, options [nop,nop,TS val 413417794 ecr 4185101807], length 4344
17:45:45.812886 IP 192.168.122.239.9801 > 192.168.122.1.60374: Flags [.], ack 1751442176, win 1420, options [nop,nop,TS val 4185101809 ecr 413417794], length 0
17:45:45.812893 IP 192.168.122.239.9801 > 192.168.122.1.60374: Flags [.], ack 1751446520, win 1396, options [nop,nop,TS val 4185101809 ecr 413417794], length 0
17:45:45.812894 IP 192.168.122.239.9801 > 192.168.122.1.60373: Flags [.], ack 1711197276, win 770, options [nop,nop,TS val 4185101809 ecr 413417794], length 0
17:45:45.812895 IP 192.168.122.239.9801 > 192.168.122.1.60373: Flags [.], ack 1711201620, win 838, options [nop,nop,TS val 4185101809 ecr 413417794], length 0
17:45:45.812966 IP 192.168.122.1.60374 > 192.168.122.239.9801: Flags [.], seq 1751446520:1751447968, ack 3274801826, win 229, options [nop,nop,TS val 413417796 ecr 4185101809], length 1448
17:45:45.812969 IP 192.168.122.1.60374 > 192.168.122.239.9801: Flags [.], seq 1751447968:1751450864, ack 3274801826, win 229, options [nop,nop,TS val 413417796 ecr 4185101809], length 2896
17:45:45.812973 IP 192.168.122.1.60374 > 192.168.122.239.9801: Flags [.], seq 1751450864:1751453760, ack 3274801826, win 229, options [nop,nop,TS val 413417796 ecr 4185101809], length 2896
17:45:45.812974 IP 192.168.122.1.60373 > 192.168.122.239.9801: Flags [.], seq 1711201620:1711204516, ack 1773965768, win 229, options [nop,nop,TS val 413417796 ecr 4185101809], length 2896
17:45:45.812976 IP 192.168.122.1.60373 > 192.168.122.239.9801: Flags [.], seq 1711204516:1711207412, ack 1773965768, win 229, options [nop,nop,TS val 413417796 ecr 4185101809], length 2896
17:45:45.823029 IP 192.168.122.239.9801 > 192.168.122.1.60373: Flags [.], ack 1711204516, win 883, options [nop,nop,TS val 4185101812 ecr 413417796], length 0
17:45:45.823036 IP 192.168.122.239.9801 > 192.168.122.1.60373: Flags [.], ack 1711207412, win 928, options [nop,nop,TS val 4185101812 ecr 413417796], length 0
17:45:45.823037 IP 192.168.122.239.9801 > 192.168.122.1.60374: Flags [.], ack 1751446520, win 1448, options [nop,nop,TS val 4185101812 ecr 413417794,nop,nop,sack 1 {1751447968:1751450864}], length 0
17:45:45.823037 IP 192.168.122.239.9801 > 192.168.122.1.60374: Flags [.], ack 1751446520, win 1448, options [nop,nop,TS val 4185101812 ecr 413417794,nop,nop,sack 1 {1751447968:1751453760}], length 0
17:45:45.823103 IP 192.168.122.1.60373 > 192.168.122.239.9801: Flags [.], seq 1711207412:1711210308, ack 1773965768, win 229, options [nop,nop,TS val 413417799 ecr 4185101812], length 2896
17:45:45.823109 IP 192.168.122.1.60373 > 192.168.122.239.9801: Flags [P.], seq 1711210308:1711213204, ack 1773965768, win 229, options [nop,nop,TS val 413417799 ecr 4185101812], length 2896
17:45:45.823110 IP 192.168.122.1.60374 > 192.168.122.239.9801: Flags [P.], seq 1751453760:1751456656, ack 3274801826, win 229, options [nop,nop,TS val 413417799 ecr 4185101812], length 2896
17:45:45.823112 IP 192.168.122.1.60374 > 192.168.122.239.9801: Flags [.], seq 1751456656:1751458104, ack 3274801826, win 229, options [nop,nop,TS val 413417799 ecr 4185101812], length 1448
17:45:45.823113 IP 192.168.122.1.60374 > 192.168.122.239.9801: Flags [.], seq 1751446520:1751447968, ack 3274801826, win 229, options [nop,nop,TS val 413417799 ecr 4185101812], length 1448
17:45:45.833165 IP 192.168.122.239.9801 > 192.168.122.1.60374: Flags [.], ack 1751446520, win 1448, options [nop,nop,TS val 4185101814 ecr 413417794,nop,nop,sack 1 {1751447968:1751456656}], length 0
17:45:45.833172 IP 192.168.122.239.9801 > 192.168.122.1.60374: Flags [.], ack 1751446520, win 1448, options [nop,nop,TS val 4185101814 ecr 413417794,nop,nop,sack 1 {1751447968:1751458104}], length 0
17:45:45.833173 IP 192.168.122.239.9801 > 192.168.122.1.60374: Flags [.], ack 1751458104, win 1412, options [nop,nop,TS val 4185101814 ecr 413417799], length 0
17:45:45.833173 IP 192.168.122.239.9801 > 192.168.122.1.60373: Flags [.], ack 1711210308, win 973, options [nop,nop,TS val 4185101814 ecr 413417799], length 0
17:45:45.833174 IP 192.168.122.239.9801 > 192.168.122.1.60373: Flags [.], ack 1711213204, win 1019, options [nop,nop,TS val 4185101814 ecr 413417799], length 0
17:45:45.833248 IP 192.168.122.1.60373 > 192.168.122.239.9801: Flags [.], seq 1711213204:1711216100, ack 1773965768, win 229, options [nop,nop,TS val 413417801 ecr 4185101814], length 2896
17:45:45.833254 IP 192.168.122.1.60373 > 192.168.122.239.9801: Flags [.], seq 1711216100:1711218996, ack 1773965768, win 229, options [nop,nop,TS val 413417801 ecr 4185101814], length 2896
17:45:45.833255 IP 192.168.122.1.60374 > 192.168.122.239.9801: Flags [.], seq 1751458104:1751462448, ack 3274801826, win 229, options [nop,nop,TS val 413417801 ecr 4185101814], length 4344
17:45:45.843306 IP 192.168.122.239.9801 > 192.168.122.1.60373: Flags [.], ack 1711216100, win 1064, options [nop,nop,TS val 4185101817 ecr 413417801], length 0
17:45:45.843313 IP 192.168.122.239.9801 > 192.168.122.1.60373: Flags [.], ack 1711218996, win 1109, options [nop,nop,TS val 4185101817 ecr 413417801], length 0
17:45:45.843421 IP 192.168.122.1.60373 > 192.168.122.239.9801: Flags [.], seq 1711218996:1711221892, ack 1773965768, win 229, options [nop,nop,TS val 413417804 ecr 4185101817], length 2896
17:45:45.843427 IP 192.168.122.1.60373 > 192.168.122.239.9801: Flags [.], seq 1711221892:1711224788, ack 1773965768, win 229, options [nop,nop,TS val 413417804 ecr 4185101817], length 2896
17:45:45.853482 IP 192.168.122.239.9801 > 192.168.122.1.60373: Flags [.], ack 1711221892, win 1154, options [nop,nop,TS val 4185101820 ecr 413417804], length 0
17:45:45.853489 IP 192.168.122.239.9801 > 192.168.122.1.60373: Flags [.], ack 1711224788, win 1200, options [nop,nop,TS val 4185101820 ecr 413417804], length 0
17:45:45.853547 IP 192.168.122.1.60373 > 192.168.122.239.9801: Flags [P.], seq 1711224788:1711227684, ack 1773965768, win 229, options [nop,nop,TS val 413417806 ecr 4185101820], length 2896
17:45:45.853553 IP 192.168.122.1.60373 > 192.168.122.239.9801: Flags [.], seq 1711227684:1711230580, ack 1773965768, win 229, options [nop,nop,TS val 413417806 ecr 4185101820], length 2896
17:45:45.863602 IP 192.168.122.239.9801 > 192.168.122.1.60373: Flags [.], ack 1711227684, win 1245, options [nop,nop,TS val 4185101822 ecr 413417806], length 0
17:45:45.863609 IP 192.168.122.239.9801 > 192.168.122.1.60373: Flags [.], ack 1711230580, win 1290, options [nop,nop,TS val 4185101822 ecr 413417806], length 0
17:45:45.863717 IP 192.168.122.1.60373 > 192.168.122.239.9801: Flags [.], seq 1711230580:1711233476, ack 1773965768, win 229, options [nop,nop,TS val 413417809 ecr 4185101822], length 2896
17:45:45.863723 IP 192.168.122.1.60373 > 192.168.122.239.9801: Flags [.], seq 1711233476:1711236372, ack 1773965768, win 229, options [nop,nop,TS val 413417809 ecr 4185101822], length 2896
17:45:45.873784 IP 192.168.122.239.9801 > 192.168.122.1.60373: Flags [.], ack 1711233476, win 1335, options [nop,nop,TS val 4185101825 ecr 413417809], length 0
17:45:45.873790 IP 192.168.122.239.9801 > 192.168.122.1.60373: Flags [.], ack 1711236372, win 1381, options [nop,nop,TS val 4185101825 ecr 413417809], length 0
17:45:45.873873 IP 192.168.122.1.60373 > 192.168.122.239.9801: Flags [.], seq 1711236372:1711239268, ack 1773965768, win 229, options [nop,nop,TS val 413417812 ecr 4185101825], length 2896
17:45:45.873879 IP 192.168.122.1.60373 > 192.168.122.239.9801: Flags [.], seq 1711239268:1711242164, ack 1773965768, win 229, options [nop,nop,TS val 413417812 ecr 4185101825], length 2896
17:45:45.883939 IP 192.168.122.239.9801 > 192.168.122.1.60373: Flags [.], ack 1711239268, win 1426, options [nop,nop,TS val 4185101827 ecr 413417812], length 0
17:45:45.883946 IP 192.168.122.239.9801 > 192.168.122.1.60373: Flags [.], ack 1711242164, win 1452, options [nop,nop,TS val 4185101827 ecr 413417812], length 0
17:45:45.884009 IP 192.168.122.1.60373 > 192.168.122.239.9801: Flags [.], seq 1711245060:1711247956, ack 1773965768, win 229, options [nop,nop,TS val 413417814 ecr 4185101827], length 2896
17:45:45.894074 IP 192.168.122.239.9801 > 192.168.122.1.60373: Flags [.], ack 1711242164, win 1452, options [nop,nop,TS val 4185101830 ecr 413417812,nop,nop,sack 1 {1711245060:1711247956}], length 0
17:45:45.894161 IP 192.168.122.1.60373 > 192.168.122.239.9801: Flags [.], seq 1711242164:1711243612, ack 1773965768, win 229, options [nop,nop,TS val 413417817 ecr 4185101830], length 1448
17:45:45.894177 IP 192.168.122.1.60373 > 192.168.122.239.9801: Flags [.], seq 1711247956:1711249404, ack 1773965768, win 229, options [nop,nop,TS val 413417817 ecr 4185101830], length 1448
17:45:45.904238 IP 192.168.122.239.9801 > 192.168.122.1.60373: Flags [.], ack 1711243612, win 1448, options [nop,nop,TS val 4185101832 ecr 413417817,nop,nop,sack 1 {1711245060:1711247956}], length 0
17:45:45.904244 IP 192.168.122.239.9801 > 192.168.122.1.60373: Flags [.], ack 1711243612, win 1448, options [nop,nop,TS val 4185101832 ecr 413417817,nop,nop,sack 1 {1711245060:1711249404}], length 0
17:45:45.904330 IP 192.168.122.1.60373 > 192.168.122.239.9801: Flags [.], seq 1711249404:1711250852, ack 1773965768, win 229, options [nop,nop,TS val 413417819 ecr 4185101832], length 1448
17:45:45.904333 IP 192.168.122.1.60373 > 192.168.122.239.9801: Flags [.], seq 1711243612:1711245060, ack 1773965768, win 229, options [nop,nop,TS val 413417819 ecr 4185101832], length 1448
17:45:45.904337 IP 192.168.122.1.60373 > 192.168.122.239.9801: Flags [.], seq 1711250852:1711252300, ack 1773965768, win 229, options [nop,nop,TS val 413417819 ecr 4185101832], length 1448
17:45:45.914397 IP 192.168.122.239.9801 > 192.168.122.1.60373: Flags [.], ack 1711249404, win 1440, options [nop,nop,TS val 4185101835 ecr 413417819], length 0
17:45:45.914404 IP 192.168.122.239.9801 > 192.168.122.1.60373: Flags [.], ack 1711249404, win 1440, options [nop,nop,TS val 4185101835 ecr 413417819,nop,nop,sack 1 {1711250852:1711252300}], length 0
17:45:45.914488 IP 192.168.122.1.60373 > 192.168.122.239.9801: Flags [P.], seq 1711252300:1711253748, ack 1773965768, win 229, options [nop,nop,TS val 413417822 ecr 4185101835], length 1448
17:45:45.914494 IP 192.168.122.1.60373 > 192.168.122.239.9801: Flags [.], seq 1711253748:1711255196, ack 1773965768, win 229, options [nop,nop,TS val 413417822 ecr 4185101835], length 1448
17:45:45.924554 IP 192.168.122.239.9801 > 192.168.122.1.60373: Flags [.], ack 1711249404, win 1446, options [nop,nop,TS val 4185101837 ecr 413417819,nop,nop,sack 1 {1711250852:1711253748}], length 0
17:45:45.924560 IP 192.168.122.239.9801 > 192.168.122.1.60373: Flags [.], ack 1711249404, win 1446, options [nop,nop,TS val 4185101837 ecr 413417819,nop,nop,sack 1 {1711250852:1711255196}], length 0
17:45:45.924669 IP 192.168.122.1.60373 > 192.168.122.239.9801: Flags [.], seq 1711255196:1711256644, ack 1773965768, win 229, options [nop,nop,TS val 413417824 ecr 4185101837], length 1448
17:45:45.924675 IP 192.168.122.1.60373 > 192.168.122.239.9801: Flags [.], seq 1711249404:1711250852, ack 1773965768, win 229, options [nop,nop,TS val 413417824 ecr 4185101837], length 1448
17:45:45.934730 IP 192.168.122.239.9801 > 192.168.122.1.60373: Flags [.], ack 1711249404, win 1446, options [nop,nop,TS val 4185101840 ecr 413417819,nop,nop,sack 1 {1711250852:1711256644}], length 0
17:45:45.934736 IP 192.168.122.239.9801 > 192.168.122.1.60373: Flags [.], ack 1711256644, win 1430, options [nop,nop,TS val 4185101840 ecr 413417824], length 0
17:45:45.934821 IP 192.168.122.1.60373 > 192.168.122.239.9801: Flags [.], seq 1711256644:1711259540, ack 1773965768, win 229, options [nop,nop,TS val 413417827 ecr 4185101840], length 2896
17:45:45.944865 IP 192.168.122.239.9801 > 192.168.122.1.60373: Flags [.], ack 1711259540, win 1452, options [nop,nop,TS val 4185101842 ecr 413417827], length 0
17:45:45.944941 IP 192.168.122.1.60373 > 192.168.122.239.9801: Flags [.], seq 1711259540:1711262436, ack 1773965768, win 229, options [nop,nop,TS val 413417829 ecr 4185101842], length 2896
17:45:45.944950 IP 192.168.122.1.60373 > 192.168.122.239.9801: Flags [.], seq 1711262436:1711263884, ack 1773965768, win 229, options [nop,nop,TS val 413417829 ecr 4185101842], length 1448
17:45:45.954984 IP 192.168.122.239.9801 > 192.168.122.1.60373: Flags [.], ack 1711262436, win 1452, options [nop,nop,TS val 4185101845 ecr 413417829], length 0
17:45:45.954992 IP 192.168.122.239.9801 > 192.168.122.1.60373: Flags [.], ack 1711263884, win 1452, options [nop,nop,TS val 4185101845 ecr 413417829], length 0
17:45:45.955048 IP 192.168.122.1.60373 > 192.168.122.239.9801: Flags [.], seq 1711263884:1711268228, ack 1773965768, win 229, options [nop,nop,TS val 413417832 ecr 4185101845], length 4344
17:45:45.965113 IP 192.168.122.239.9801 > 192.168.122.1.60373: Flags [.], ack 1711268228, win 1452, options [nop,nop,TS val 4185101847 ecr 413417832], length 0
17:45:45.965186 IP 192.168.122.1.60373 > 192.168.122.239.9801: Flags [.], seq 1711271124:1711272572, ack 1773965768, win 229, options [nop,nop,TS val 413417834 ecr 4185101847], length 1448
17:45:45.975253 IP 192.168.122.239.9801 > 192.168.122.1.60373: Flags [.], ack 1711268228, win 1452, options [nop,nop,TS val 4185101850 ecr 413417832,nop,nop,sack 1 {1711271124:1711272572}], length 0
17:45:45.975338 IP 192.168.122.1.60373 > 192.168.122.239.9801: Flags [.], seq 1711272572:1711274020, ack 1773965768, win 229, options [nop,nop,TS val 413417837 ecr 4185101850], length 1448
17:45:46.037789 IP 192.168.122.1.60374 > 192.168.122.239.9801: Flags [.], seq 1751458104:1751459552, ack 3274801826, win 229, options [nop,nop,TS val 413417853 ecr 4185101814], length 1448
17:45:46.047856 IP 192.168.122.239.9801 > 192.168.122.1.60374: Flags [.], ack 1751459552, win 1452, options [nop,nop,TS val 4185101868 ecr 413417853], length 0
17:45:46.047966 IP 192.168.122.1.60374 > 192.168.122.239.9801: Flags [.], seq 1751462448:1751465344, ack 3274801826, win 229, options [nop,nop,TS val 413417855 ecr 4185101868], length 2896
17:45:46.058036 IP 192.168.122.239.9801 > 192.168.122.1.60374: Flags [.], ack 1751459552, win 1452, options [nop,nop,TS val 4185101871 ecr 413417853,nop,nop,sack 1 {1751462448:1751465344}], length 0
17:45:46.058148 IP 192.168.122.1.60374 > 192.168.122.239.9801: Flags [.], seq 1751459552:1751462448, ack 3274801826, win 229, options [nop,nop,TS val 413417858 ecr 4185101871], length 2896
17:45:46.068213 IP 192.168.122.239.9801 > 192.168.122.1.60374: Flags [.], ack 1751465344, win 1448, options [nop,nop,TS val 4185101873 ecr 413417858], length 0
17:45:46.068300 IP 192.168.122.1.60374 > 192.168.122.239.9801: Flags [.], seq 1751465344:1751468240, ack 3274801826, win 229, options [nop,nop,TS val 413417860 ecr 4185101873], length 2896
17:45:46.068306 IP 192.168.122.1.60374 > 192.168.122.239.9801: Flags [.], seq 1751468240:1751469688, ack 3274801826, win 229, options [nop,nop,TS val 413417860 ecr 4185101873], length 1448
17:45:46.078365 IP 192.168.122.239.9801 > 192.168.122.1.60374: Flags [.], ack 1751468240, win 1452, options [nop,nop,TS val 4185101876 ecr 413417860], length 0
17:45:46.078371 IP 192.168.122.239.9801 > 192.168.122.1.60374: Flags [.], ack 1751469688, win 1452, options [nop,nop,TS val 4185101876 ecr 413417860], length 0
17:45:46.078456 IP 192.168.122.1.60374 > 192.168.122.239.9801: Flags [.], seq 1751469688:1751474032, ack 3274801826, win 229, options [nop,nop,TS val 413417863 ecr 4185101876], length 4344
17:45:46.088519 IP 192.168.122.239.9801 > 192.168.122.1.60374: Flags [.], ack 1751474032, win 1452, options [nop,nop,TS val 4185101878 ecr 413417863], length 0
17:45:46.088585 IP 192.168.122.1.60374 > 192.168.122.239.9801: Flags [.], seq 1751474032:1751476928, ack 3274801826, win 229, options [nop,nop,TS val 413417865 ecr 4185101878], length 2896
17:45:46.088591 IP 192.168.122.1.60374 > 192.168.122.239.9801: Flags [.], seq 1751476928:1751478376, ack 3274801826, win 229, options [nop,nop,TS val 413417865 ecr 4185101878], length 1448
17:45:46.098623 IP 192.168.122.239.9801 > 192.168.122.1.60374: Flags [.], ack 1751476928, win 1452, options [nop,nop,TS val 4185101881 ecr 413417865], length 0
17:45:46.098629 IP 192.168.122.239.9801 > 192.168.122.1.60374: Flags [.], ack 1751478376, win 1452, options [nop,nop,TS val 4185101881 ecr 413417865], length 0
17:45:46.098738 IP 192.168.122.1.60374 > 192.168.122.239.9801: Flags [.], seq 1751478376:1751482720, ack 3274801826, win 229, options [nop,nop,TS val 413417868 ecr 4185101881], length 4344
17:45:46.108801 IP 192.168.122.239.9801 > 192.168.122.1.60374: Flags [.], ack 1751482720, win 1452, options [nop,nop,TS val 4185101883 ecr 413417868], length 0
17:45:46.108888 IP 192.168.122.1.60374 > 192.168.122.239.9801: Flags [.], seq 1751485616:1751487064, ack 3274801826, win 229, options [nop,nop,TS val 413417870 ecr 4185101883], length 1448
17:45:46.118953 IP 192.168.122.239.9801 > 192.168.122.1.60374: Flags [.], ack 1751482720, win 1452, options [nop,nop,TS val 4185101886 ecr 413417868,nop,nop,sack 1 {1751485616:1751487064}], length 0
17:45:46.119039 IP 192.168.122.1.60374 > 192.168.122.239.9801: Flags [.], seq 1751487064:1751488512, ack 3274801826, win 229, options [nop,nop,TS val 413417873 ecr 4185101886], length 1448
17:45:46.129102 IP 192.168.122.239.9801 > 192.168.122.1.60374: Flags [.], ack 1751482720, win 1452, options [nop,nop,TS val 4185101888 ecr 413417868,nop,nop,sack 1 {1751485616:1751488512}], length 0
17:45:46.129177 IP 192.168.122.1.60374 > 192.168.122.239.9801: Flags [.], seq 1751482720:1751484168, ack 3274801826, win 229, options [nop,nop,TS val 413417875 ecr 4185101888], length 1448
17:45:46.169897 IP 192.168.122.1.60373 > 192.168.122.239.9801: Flags [.], seq 1711268228:1711269676, ack 1773965768, win 229, options [nop,nop,TS val 413417886 ecr 4185101850], length 1448
17:45:46.180085 IP 192.168.122.239.9801 > 192.168.122.1.60373: Flags [.], ack 1711269676, win 1452, options [nop,nop,TS val 4185101901 ecr 413417886,nop,nop,sack 1 {1711271124:1711272572}], length 0
17:45:46.180272 IP 192.168.122.1.60373 > 192.168.122.239.9801: Flags [.], seq 1711274020:1711276916, ack 1773965768, win 229, options [nop,nop,TS val 413417888 ecr 4185101901], length 2896
17:45:46.190448 IP 192.168.122.239.9801 > 192.168.122.1.60373: Flags [.], ack 1711269676, win 1452, options [nop,nop,TS val 4185101904 ecr 413417886,nop,nop,sack 2 {1711274020:1711276916}{1711271124:1711272572}], length 0
17:45:46.190651 IP 192.168.122.1.60373 > 192.168.122.239.9801: Flags [.], seq 1711269676:1711271124, ack 1773965768, win 229, options [nop,nop,TS val 413417891 ecr 4185101904], length 1448
17:45:46.190675 IP 192.168.122.1.60373 > 192.168.122.239.9801: Flags [.], seq 1711272572:1711274020, ack 1773965768, win 229, options [nop,nop,TS val 413417891 ecr 4185101904], length 1448
17:45:46.200837 IP 192.168.122.239.9801 > 192.168.122.1.60373: Flags [.], ack 1711272572, win 1439, options [nop,nop,TS val 4185101906 ecr 413417891,nop,nop,sack 1 {1711274020:1711276916}], length 0
17:45:46.200865 IP 192.168.122.239.9801 > 192.168.122.1.60373: Flags [.], ack 1711276916, win 1432, options [nop,nop,TS val 4185101906 ecr 413417891], length 0
17:45:46.201072 IP 192.168.122.1.60373 > 192.168.122.239.9801: Flags [.], seq 1711276916:1711279812, ack 1773965768, win 229, options [nop,nop,TS val 413417893 ecr 4185101906], length 2896
17:45:46.201099 IP 192.168.122.1.60373 > 192.168.122.239.9801: Flags [.], seq 1711279812:1711281260, ack 1773965768, win 229, options [nop,nop,TS val 413417893 ecr 4185101906], length 1448
17:45:46.211262 IP 192.168.122.239.9801 > 192.168.122.1.60373: Flags [.], ack 1711279812, win 1452, options [nop,nop,TS val 4185101909 ecr 413417893], length 0
17:45:46.211291 IP 192.168.122.239.9801 > 192.168.122.1.60373: Flags [.], ack 1711281260, win 1452, options [nop,nop,TS val 4185101909 ecr 413417893], length 0
17:45:46.211489 IP 192.168.122.1.60373 > 192.168.122.239.9801: Flags [P.], seq 1711281260:1711282708, ack 1773965768, win 229, options [nop,nop,TS val 413417896 ecr 4185101909], length 1448
17:45:46.211521 IP 192.168.122.1.60373 > 192.168.122.239.9801: Flags [.], seq 1711282708:1711285604, ack 1773965768, win 229, options [nop,nop,TS val 413417896 ecr 4185101909], length 2896
17:45:46.221689 IP 192.168.122.239.9801 > 192.168.122.1.60373: Flags [.], ack 1711282708, win 1452, options [nop,nop,TS val 4185101912 ecr 413417896], length 0
17:45:46.221740 IP 192.168.122.239.9801 > 192.168.122.1.60373: Flags [.], ack 1711285604, win 1452, options [nop,nop,TS val 4185101912 ecr 413417896], length 0
