17:34:04.018276 IP 192.168.122.1.60343 > 192.168.122.239.9801: Flags [S], seq 560438475, win 29200, options [mss 1460,sackOK,TS val 413242348 ecr 0,nop,wscale 7], length 0
17:34:04.018306 IP 192.168.122.239.9801 > 192.168.122.1.60343: Flags [S.], seq 427075314, ack 560438476, win 28960, options [mss 1460,sackOK,TS val 4184926363 ecr 413242348,nop,wscale 7], length 0
17:34:04.018414 IP 192.168.122.1.60343 > 192.168.122.239.9801: Flags [.], ack 427075315, win 229, options [nop,nop,TS val 413242348 ecr 4184926363], length 0
17:34:04.018468 IP 192.168.122.1.60343 > 192.168.122.239.9801: Flags [P.], seq 560438476:560438500, ack 427075315, win 229, options [nop,nop,TS val 413242348 ecr 4184926363], length 24
17:34:04.018480 IP 192.168.122.239.9801 > 192.168.122.1.60343: Flags [.], ack 560438500, win 227, options [nop,nop,TS val 4184926363 ecr 413242348], length 0
17:34:04.018493 IP 192.168.122.1.60343 > 192.168.122.239.9801: Flags [.], seq 560438500:560451532, ack 427075315, win 229, options [nop,nop,TS val 413242348 ecr 4184926363], length 13032
17:34:04.018501 IP 192.168.122.239.9801 > 192.168.122.1.60343: Flags [.], ack 560451532, win 430, options [nop,nop,TS val 4184926363 ecr 413242348], length 0
17:34:04.029769 IP 192.168.122.1.60343 > 192.168.122.239.9801: Flags [.], seq 560466012:560467460, ack 427075315, win 229, options [nop,nop,TS val 413242351 ecr 4184926363], length 1448
17:34:04.029801 IP 192.168.122.239.9801 > 192.168.122.1.60343: Flags [.], ack 560451532, win 453, options [nop,nop,TS val 4184926366 ecr 413242348,nop,nop,sack 1 {560466012:560467460}], length 0
17:34:04.029894 IP 192.168.122.1.60343 > 192.168.122.239.9801: Flags [.], seq 560451532:560454428, ack 427075315, win 229, options [nop,nop,TS val 413242351 ecr 4184926366], length 2896
17:34:04.029922 IP 192.168.122.239.9801 > 192.168.122.1.60343: Flags [.], ack 560454428, win 498, options [nop,nop,TS val 4184926366 ecr 413242351,nop,nop,sack 1 {560466012:560467460}], length 0
17:34:04.030020 IP 192.168.122.1.60343 > 192.168.122.239.9801: Flags [.], seq 560454428:560458772, ack 427075315, win 229, options [nop,nop,TS val 413242351 ecr 4184926366], length 4344
17:34:04.030048 IP 192.168.122.239.9801 > 192.168.122.1.60343: Flags [.], ack 560458772, win 566, options [nop,nop,TS val 4184926366 ecr 413242351,nop,nop,sack 1 {560466012:560467460}], length 0
17:34:04.030140 IP 192.168.122.1.60343 > 192.168.122.239.9801: Flags [.], seq 560458772:560463116, ack 427075315, win 229, options [nop,nop,TS val 413242351 ecr 4184926366], length 4344
17:34:04.030150 IP 192.168.122.1.60343 > 192.168.122.239.9801: Flags [.], seq 560467460:560468908, ack 427075315, win 229, options [nop,nop,TS val 413242351 ecr 4184926366], length 1448
17:34:04.030170 IP 192.168.122.239.9801 > 192.168.122.1.60343: Flags [.], ack 560463116, win 634, options [nop,nop,TS val 4184926366 ecr 413242351,nop,nop,sack 1 {560466012:560467460}], length 0
17:34:04.030181 IP 192.168.122.239.9801 > 192.168.122.1.60343: Flags [.], ack 560463116, win 657, options [nop,nop,TS val 4184926366 ecr 413242351,nop,nop,sack 1 {560466012:560468908}], length 0
17:34:04.030268 IP 192.168.122.1.60343 > 192.168.122.239.9801: Flags [.], seq 560463116:560464564, ack 427075315, win 229, options [nop,nop,TS val 413242351 ecr 4184926366], length 1448
17:34:04.030277 IP 192.168.122.1.60343 > 192.168.122.239.9801: Flags [.], seq 560474700:560476148, ack 427075315, win 229, options [nop,nop,TS val 413242351 ecr 4184926366], length 1448
17:34:04.030297 IP 192.168.122.239.9801 > 192.168.122.1.60343: Flags [.], ack 560464564, win 679, options [nop,nop,TS val 4184926366 ecr 413242351,nop,nop,sack 1 {560466012:560468908}], length 0
17:34:04.030308 IP 192.168.122.239.9801 > 192.168.122.1.60343: Flags [.], ack 560464564, win 702, options [nop,nop,TS val 4184926366 ecr 413242351,nop,nop,sack 2 {560474700:560476148}{560466012:560468908}], length 0
17:34:04.030394 IP 192.168.122.1.60343 > 192.168.122.239.9801: Flags [.], seq 560476148:560477596, ack 427075315, win 229, options [nop,nop,TS val 413242351 ecr 4184926366], length 1448
17:34:04.030402 IP 192.168.122.1.60343 > 192.168.122.239.9801: Flags [P.], seq 560464564:560466012, ack 427075315, win 229, options [nop,nop,TS val 413242351 ecr 4184926366], length 1448
17:34:04.030404 IP 192.168.122.1.60343 > 192.168.122.239.9801: Flags [.], seq 560468908:560470356, ack 427075315, win 229, options [nop,nop,TS val 413242351 ecr 4184926366], length 1448
17:34:04.030424 IP 192.168.122.239.9801 > 192.168.122.1.60343: Flags [.], ack 560464564, win 724, options [nop,nop,TS val 4184926366 ecr 413242351,nop,nop,sack 2 {560474700:560477596}{560466012:560468908}], length 0
17:34:04.030436 IP 192.168.122.239.9801 > 192.168.122.1.60343: Flags [.], ack 560468908, win 747, options [nop,nop,TS val 4184926366 ecr 413242351,nop,nop,sack 1 {560474700:560477596}], length 0
17:34:04.030438 IP 192.168.122.239.9801 > 192.168.122.1.60343: Flags [.], ack 560470356, win 770, options [nop,nop,TS val 4184926366 ecr 413242351,nop,nop,sack 1 {560474700:560477596}], length 0
17:34:04.030503 IP 192.168.122.1.60343 > 192.168.122.239.9801: Flags [.], seq 560470356:560473252, ack 427075315, win 229, options [nop,nop,TS val 413242351 ecr 4184926366], length 2896
17:34:04.030507 IP 192.168.122.1.60343 > 192.168.122.239.9801: Flags [.], seq 560477596:560479044, ack 427075315, win 229, options [nop,nop,TS val 413242351 ecr 4184926366], length 1448
17:34:04.030517 IP 192.168.122.239.9801 > 192.168.122.1.60343: Flags [.], ack 560473252, win 815, options [nop,nop,TS val 4184926366 ecr 413242351,nop,nop,sack 1 {560474700:560477596}], length 0
17:34:04.030525 IP 192.168.122.239.9801 > 192.168.122.1.60343: Flags [.], ack 560473252, win 838, options [nop,nop,TS val 4184926366 ecr 413242351,nop,nop,sack 1 {560474700:560479044}], length 0
17:34:04.030589 IP 192.168.122.1.60343 > 192.168.122.239.9801: Flags [.], seq 560479044:560481940, ack 427075315, win 229, options [nop,nop,TS val 413242351 ecr 4184926366], length 2896
17:34:04.030593 IP 192.168.122.1.60343 > 192.168.122.239.9801: Flags [.], seq 560473252:560474700, ack 427075315, win 229, options [nop,nop,TS val 413242351 ecr 4184926366], length 1448
17:34:04.030594 IP 192.168.122.1.60343 > 192.168.122.239.9801: Flags [.], seq 560481940:560483388, ack 427075315, win 229, options [nop,nop,TS val 413242351 ecr 4184926366], length 1448
17:34:04.030603 IP 192.168.122.239.9801 > 192.168.122.1.60343: Flags [.], ack 560473252, win 883, options [nop,nop,TS val 4184926366 ecr 413242351,nop,nop,sack 1 {560474700:560481940}], length 0
17:34:04.030609 IP 192.168.122.239.9801 > 192.168.122.1.60343: Flags [.], ack 560481940, win 905, options [nop,nop,TS val 4184926366 ecr 413242351], length 0
17:34:04.030611 IP 192.168.122.239.9801 > 192.168.122.1.60343: Flags [.], ack 560483388, win 928, options [nop,nop,TS val 4184926366 ecr 413242351], length 0
17:34:04.030661 IP 192.168.122.1.60343 > 192.168.122.239.9801: Flags [.], seq 560483388:560486284, ack 427075315, win 229, options [nop,nop,TS val 413242351 ecr 4184926366], length 2896
17:34:04.030665 IP 192.168.122.1.60343 > 192.168.122.239.9801: Flags [.], seq 560486284:560490628, ack 427075315, win 229, options [nop,nop,TS val 413242351 ecr 4184926366], length 4344
17:34:04.030673 IP 192.168.122.239.9801 > 192.168.122.1.60343: Flags [.], ack 560486284, win 973, options [nop,nop,TS val 4184926366 ecr 413242351], length 0
17:34:04.030681 IP 192.168.122.239.9801 > 192.168.122.1.60343: Flags [.], ack 560490628, win 1041, options [nop,nop,TS val 4184926366 ecr 413242351], length 0
17:34:04.030708 IP 192.168.122.1.60343 > 192.168.122.239.9801: Flags [P.], seq 560493524:560494972, ack 427075315, win 229, options [nop,nop,TS val 413242351 ecr 4184926366], length 1448
17:34:04.030712 IP 192.168.122.1.60343 > 192.168.122.239.9801: Flags [.], seq 560494972:560497868, ack 427075315, win 229, options [nop,nop,TS val 413242351 ecr 4184926366], length 2896
17:34:04.030720 IP 192.168.122.239.9801 > 192.168.122.1.60343: Flags [.], ack 560490628, win 1064, options [nop,nop,TS val 4184926366 ecr 413242351,nop,nop,sack 1 {560493524:560494972}], length 0
17:34:04.030727 IP 192.168.122.239.9801 > 192.168.122.1.60343: Flags [.], ack 560490628, win 1109, options [nop,nop,TS val 4184926366 ecr 413242351,nop,nop,sack 1 {560493524:560497868}], length 0
17:34:04.030765 IP 192.168.122.1.60343 > 192.168.122.239.9801: Flags [.], seq 560497868:560499316, ack 427075315, win 229, options [nop,nop,TS val 413242351 ecr 4184926366], length 1448
17:34:04.030770 IP 192.168.122.1.60343 > 192.168.122.239.9801: Flags [.], seq 560490628:560493524, ack 427075315, win 229, options [nop,nop,TS val 413242351 ecr 4184926366], length 2896
17:34:04.030779 IP 192.168.122.239.9801 > 192.168.122.1.60343: Flags [.], ack 560490628, win 1132, options [nop,nop,TS val 4184926366 ecr 413242351,nop,nop,sack 1 {560493524:560499316}], length 0
17:34:04.030786 IP 192.168.122.239.9801 > 192.168.122.1.60343: Flags [.], ack 560499316, win 1177, options [nop,nop,TS val 4184926366 ecr 413242351], length 0
17:34:04.030808 IP 192.168.122.1.60343 > 192.168.122.239.9801: Flags [.], seq 560499316:560500764, ack 427075315, win 229, options [nop,nop,TS val 413242351 ecr 4184926366], length 1448
17:34:04.030811 IP 192.168.122.1.60343 > 192.168.122.239.9801: Flags [.], seq 560500764:560503660, ack 427075315, win 229, options [nop,nop,TS val 413242351 ecr 4184926366], length 2896
17:34:04.030819 IP 192.168.122.239.9801 > 192.168.122.1.60343: Flags [.], ack 560500764, win 1200, options [nop,nop,TS val 4184926366 ecr 413242351], length 0
17:34:04.030826 IP 192.168.122.239.9801 > 192.168.122.1.60343: Flags [.], ack 560503660, win 1245, options [nop,nop,TS val 4184926366 ecr 413242351], length 0
17:34:04.030847 IP 192.168.122.1.60343 > 192.168.122.239.9801: Flags [.], seq 560503660:560506556, ack 427075315, win 229, options [nop,nop,TS val 413242351 ecr 4184926366], length 2896
17:34:04.030850 IP 192.168.122.1.60343 > 192.168.122.239.9801: Flags [.], seq 560506556:560509452, ack 427075315, win 229, options [nop,nop,TS val 413242351 ecr 4184926366], length 2896
17:34:04.030859 IP 192.168.122.239.9801 > 192.168.122.1.60343: Flags [.], ack 560506556, win 1290, options [nop,nop,TS val 4184926366 ecr 413242351], length 0
17:34:04.030865 IP 192.168.122.239.9801 > 192.168.122.1.60343: Flags [.], ack 560509452, win 1335, options [nop,nop,TS val 4184926366 ecr 413242351], length 0
17:34:04.030887 IP 192.168.122.1.60343 > 192.168.122.239.9801: Flags [.], seq 560509452:560513796, ack 427075315, win 229, options [nop,nop,TS val 413242351 ecr 4184926366], length 4344
17:34:04.030891 IP 192.168.122.1.60343 > 192.168.122.239.9801: Flags [.], seq 560513796:560516692, ack 427075315, win 229, options [nop,nop,TS val 413242351 ecr 4184926366], length 2896
17:34:04.030899 IP 192.168.122.239.9801 > 192.168.122.1.60343: Flags [.], ack 560513796, win 1403, options [nop,nop,TS val 4184926366 ecr 413242351], length 0
17:34:04.030906 IP 192.168.122.239.9801 > 192.168.122.1.60343: Flags [.], ack 560516692, win 1448, options [nop,nop,TS val 4184926366 ecr 413242351], length 0
17:34:04.030931 IP 192.168.122.1.60343 > 192.168.122.239.9801: Flags [P.], seq 560521036:560523932, ack 427075315, win 229, options [nop,nop,TS val 413242351 ecr 4184926366], length 2896
17:34:04.030942 IP 192.168.122.239.9801 > 192.168.122.1.60343: Flags [.], ack 560516692, win 1448, options [nop,nop,TS val 4184926366 ecr 413242351,nop,nop,sack 1 {560521036:560523932}], length 0
17:34:04.030973 IP 192.168.122.1.60343 > 192.168.122.239.9801: Flags [.], seq 560516692:560519588, ack 427075315, win 229, options [nop,nop,TS val 413242351 ecr 4184926366], length 2896
17:34:04.030984 IP 192.168.122.239.9801 > 192.168.122.1.60343: Flags [.], ack 560519588, win 1448, options [nop,nop,TS val 4184926366 ecr 413242351,nop,nop,sack 1 {560521036:560523932}], length 0
17:34:04.031007 IP 192.168.122.1.60343 > 192.168.122.239.9801: Flags [.], seq 560523932:560526828, ack 427075315, win 229, options [nop,nop,TS val 413242351 ecr 4184926366], length 2896
17:34:04.031017 IP 192.168.122.239.9801 > 192.168.122.1.60343: Flags [.], ack 560519588, win 1448, options [nop,nop,TS val 4184926366 ecr 413242351,nop,nop,sack 1 {560521036:560526828}], length 0
17:34:04.031041 IP 192.168.122.1.60343 > 192.168.122.239.9801: Flags [.], seq 560519588:560521036, ack 427075315, win 229, options [nop,nop,TS val 413242351 ecr 4184926366], length 1448
17:34:04.031044 IP 192.168.122.1.60343 > 192.168.122.239.9801: Flags [.], seq 560526828:560529724, ack 427075315, win 229, options [nop,nop,TS val 413242351 ecr 4184926366], length 2896
17:34:04.031053 IP 192.168.122.239.9801 > 192.168.122.1.60343: Flags [.], ack 560526828, win 1434, options [nop,nop,TS val 4184926366 ecr 413242351], length 0
17:34:04.031059 IP 192.168.122.239.9801 > 192.168.122.1.60343: Flags [.], ack 560529724, win 1420, options [nop,nop,TS val 4184926366 ecr 413242351], length 0
17:34:04.031082 IP 192.168.122.1.60343 > 192.168.122.239.9801: Flags [.], seq 560529724:560531172, ack 427075315, win 229, options [nop,nop,TS val 413242351 ecr 4184926366], length 1448
17:34:04.031085 IP 192.168.122.1.60343 > 192.168.122.239.9801: Flags [.], seq 560531172:560535516, ack 427075315, win 229, options [nop,nop,TS val 413242351 ecr 4184926366], length 4344
17:34:04.031094 IP 192.168.122.239.9801 > 192.168.122.1.60343: Flags [.], ack 560531172, win 1452, options [nop,nop,TS val 4184926366 ecr 413242351], length 0
17:34:04.031101 IP 192.168.122.239.9801 > 192.168.122.1.60343: Flags [.], ack 560535516, win 1452, options [nop,nop,TS val 4184926366 ecr 413242351], length 0
17:34:04.031123 IP 192.168.122.1.60343 > 192.168.122.239.9801: Flags [.], seq 560535516:560538412, ack 427075315, win 229, options [nop,nop,TS val 413242351 ecr 4184926366], length 2896
17:34:04.031127 IP 192.168.122.1.60343 > 192.168.122.239.9801: Flags [.], seq 560538412:560542756, ack 427075315, win 229, options [nop,nop,TS val 413242351 ecr 4184926366], length 4344
17:34:04.031136 IP 192.168.122.239.9801 > 192.168.122.1.60343: Flags [.], ack 560538412, win 1452, options [nop,nop,TS val 4184926366 ecr 413242351], length 0
17:34:04.031143 IP 192.168.122.239.9801 > 192.168.122.1.60343: Flags [.], ack 560542756, win 1452, options [nop,nop,TS val 4184926366 ecr 413242351], length 0
17:34:04.031164 IP 192.168.122.1.60343 > 192.168.122.239.9801: Flags [.], seq 560542756:560545652, ack 427075315, win 229, options [nop,nop,TS val 413242351 ecr 4184926366], length 2896
17:34:04.031168 IP 192.168.122.1.60343 > 192.168.122.239.9801: Flags [.], seq 560545652:560549996, ack 427075315, win 229, options [nop,nop,TS val 413242351 ecr 4184926366], length 4344
17:34:04.031176 IP 192.168.122.239.9801 > 192.168.122.1.60343: Flags [.], ack 560545652, win 1452, options [nop,nop,TS val 4184926366 ecr 413242351], length 0
17:34:04.031183 IP 192.168.122.239.9801 > 192.168.122.1.60343: Flags [.], ack 560549996, win 1452, options [nop,nop,TS val 4184926366 ecr 413242351], length 0
17:34:04.031204 IP 192.168.122.1.60343 > 192.168.122.239.9801: Flags [.], seq 560549996:560552892, ack 427075315, win 229, options [nop,nop,TS val 413242351 ecr 4184926366], length 2896
17:34:04.031208 IP 192.168.122.1.60343 > 192.168.122.239.9801: Flags [.], seq 560552892:560557236, ack 427075315, win 229, options [nop,nop,TS val 413242351 ecr 4184926366], length 4344
17:34:04.031250 IP 192.168.122.239.9801 > 192.168.122.1.60343: Flags [.], ack 560552892, win 1452, options [nop,nop,TS val 4184926367 ecr 413242351], length 0
17:34:04.031258 IP 192.168.122.239.9801 > 192.168.122.1.60343: Flags [.], ack 560557236, win 1452, options [nop,nop,TS val 4184926367 ecr 413242351], length 0
17:34:04.031279 IP 192.168.122.1.60343 > 192.168.122.239.9801: Flags [.], seq 560557236:560560132, ack 427075315, win 229, options [nop,nop,TS val 413242351 ecr 4184926367], length 2896
17:34:04.031283 IP 192.168.122.1.60343 > 192.168.122.239.9801: Flags [.], seq 560560132:560564476, ack 427075315, win 229, options [nop,nop,TS val 413242351 ecr 4184926367], length 4344
17:34:04.031292 IP 192.168.122.239.9801 > 192.168.122.1.60343: Flags [.], ack 560560132, win 1452, options [nop,nop,TS val 4184926367 ecr 413242351], length 0
17:34:04.031298 IP 192.168.122.239.9801 > 192.168.122.1.60343: Flags [.], ack 560564476, win 1452, options [nop,nop,TS val 4184926367 ecr 413242351], length 0
17:34:04.031321 IP 192.168.122.1.60343 > 192.168.122.239.9801: Flags [P.], seq 560564476:560567372, ack 427075315, win 229, options [nop,nop,TS val 413242351 ecr 4184926367], length 2896
17:34:04.031331 IP 192.168.122.239.9801 > 192.168.122.1.60343: Flags [.], ack 560567372, win 1452, options [nop,nop,TS val 4184926367 ecr 413242351], length 0
17:34:04.031349 IP 192.168.122.1.60343 > 192.168.122.239.9801: Flags [.], seq 560567372:560571716, ack 427075315, win 229, options [nop,nop,TS val 413242351 ecr 4184926367], length 4344
17:34:04.031359 IP 192.168.122.1.60343 > 192.168.122.239.9801: Flags [.], seq 560571716:560574612, ack 427075315, win 229, options [nop,nop,TS val 413242351 ecr 4184926367], length 2896
17:34:04.031363 IP 192.168.122.239.9801 > 192.168.122.1.60343: Flags [.], ack 560571716, win 1452, options [nop,nop,TS val 4184926367 ecr 413242351], length 0
17:34:04.031370 IP 192.168.122.239.9801 > 192.168.122.1.60343: Flags [.], ack 560574612, win 1452, options [nop,nop,TS val 4184926367 ecr 413242351], length 0
17:34:04.031393 IP 192.168.122.1.60343 > 192.168.122.239.9801: Flags [.], seq 560578956:560581852, ack 427075315, win 229, options [nop,nop,TS val 413242351 ecr 4184926367], length 2896
17:34:04.031403 IP 192.168.122.239.9801 > 192.168.122.1.60343: Flags [.], ack 560574612, win 1452, options [nop,nop,TS val 4184926367 ecr 413242351,nop,nop,sack 1 {560578956:560581852}], length 0
17:34:04.031429 IP 192.168.122.1.60343 > 192.168.122.239.9801: Flags [.], seq 560574612:560577508, ack 427075315, win 229, options [nop,nop,TS val 413242351 ecr 4184926367], length 2896
17:34:04.031440 IP 192.168.122.239.9801 > 192.168.122.1.60343: Flags [.], ack 560577508, win 1448, options [nop,nop,TS val 4184926367 ecr 413242351,nop,nop,sack 1 {560578956:560581852}], length 0
17:34:04.031463 IP 192.168.122.1.60343 > 192.168.122.239.9801: Flags [.], seq 560581852:560584748, ack 427075315, win 229, options [nop,nop,TS val 413242351 ecr 4184926367], length 2896
17:34:04.031474 IP 192.168.122.239.9801 > 192.168.122.1.60343: Flags [.], ack 560577508, win 1448, options [nop,nop,TS val 4184926367 ecr 413242351,nop,nop,sack 1 {560578956:560584748}], length 0
17:34:04.031497 IP 192.168.122.1.60343 > 192.168.122.239.9801: Flags [.], seq 560577508:560578956, ack 427075315, win 229, options [nop,nop,TS val 413242351 ecr 4184926367], length 1448
17:34:04.031500 IP 192.168.122.1.60343 > 192.168.122.239.9801: Flags [.], seq 560584748:560587644, ack 427075315, win 229, options [nop,nop,TS val 413242351 ecr 4184926367], length 2896
17:34:04.031509 IP 192.168.122.239.9801 > 192.168.122.1.60343: Flags [.], ack 560584748, win 1434, options [nop,nop,TS val 4184926367 ecr 413242351], length 0
17:34:04.031515 IP 192.168.122.239.9801 > 192.168.122.1.60343: Flags [.], ack 560587644, win 1420, options [nop,nop,TS val 4184926367 ecr 413242351], length 0
17:34:04.031537 IP 192.168.122.1.60343 > 192.168.122.239.9801: Flags [.], seq 560587644:560589092, ack 427075315, win 229, options [nop,nop,TS val 413242351 ecr 4184926367], length 1448
17:34:04.031540 IP 192.168.122.1.60343 > 192.168.122.239.9801: Flags [.], seq 560589092:560593436, ack 427075315, win 229, options [nop,nop,TS val 413242351 ecr 4184926367], length 4344
17:34:04.031549 IP 192.168.122.239.9801 > 192.168.122.1.60343: Flags [.], ack 560589092, win 1452, options [nop,nop,TS val 4184926367 ecr 413242351], length 0
17:34:04.031555 IP 192.168.122.239.9801 > 192.168.122.1.60343: Flags [.], ack 560593436, win 1452, options [nop,nop,TS val 4184926367 ecr 413242351], length 0
17:34:04.031576 IP 192.168.122.1.60343 > 192.168.122.239.9801: Flags [.], seq 560593436:560596332, ack 427075315, win 229, options [nop,nop,TS val 413242351 ecr 4184926367], length 2896
17:34:04.031580 IP 192.168.122.1.60343 > 192.168.122.239.9801: Flags [.], seq 560596332:560600676, ack 427075315, win 229, options [nop,nop,TS val 413242351 ecr 4184926367], length 4344
17:34:04.031589 IP 192.168.122.239.9801 > 192.168.122.1.60343: Flags [.], ack 560596332, win 1452, options [nop,nop,TS val 4184926367 ecr 413242351], length 0
17:34:04.031595 IP 192.168.122.239.9801 > 192.168.122.1.60343: Flags [.], ack 560600676, win 1452, options [nop,nop,TS val 4184926367 ecr 413242351], length 0
17:34:04.031616 IP 192.168.122.1.60343 > 192.168.122.239.9801: Flags [.], seq 560603572:560607916, ack 427075315, win 229, options [nop,nop,TS val 413242351 ecr 4184926367], length 4344
17:34:04.031627 IP 192.168.122.239.9801 > 192.168.122.1.60343: Flags [.], ack 560600676, win 1452, options [nop,nop,TS val 4184926367 ecr 413242351,nop,nop,sack 1 {560603572:560607916}], length 0
17:34:04.031654 IP 192.168.122.1.60343 > 192.168.122.239.9801: Flags [.], seq 560600676:560603572, ack 427075315, win 229, options [nop,nop,TS val 413242351 ecr 4184926367], length 2896
17:34:04.031658 IP 192.168.122.1.60343 > 192.168.122.239.9801: Flags [.], seq 560607916:560609364, ack 427075315, win 229, options [nop,nop,TS val 413242351 ecr 4184926367], length 1448
17:34:04.031667 IP 192.168.122.239.9801 > 192.168.122.1.60343: Flags [.], ack 560607916, win 1442, options [nop,nop,TS val 4184926367 ecr 413242351], length 0
17:34:04.031673 IP 192.168.122.239.9801 > 192.168.122.1.60343: Flags [.], ack 560609364, win 1434, options [nop,nop,TS val 4184926367 ecr 413242351], length 0
17:34:04.031701 IP 192.168.122.1.60343 > 192.168.122.239.9801: Flags [P.], seq 560609364:560610812, ack 427075315, win 229, options [nop,nop,TS val 413242351 ecr 4184926367], length 1448
17:34:04.031705 IP 192.168.122.1.60343 > 192.168.122.239.9801: Flags [.], seq 560610812:560612260, ack 427075315, win 229, options [nop,nop,TS val 413242351 ecr 4184926367], length 1448
17:34:04.031706 IP 192.168.122.1.60343 > 192.168.122.239.9801: Flags [.], seq 560612260:560615156, ack 427075315, win 229, options [nop,nop,TS val 413242351 ecr 4184926367], length 2896
17:34:04.031714 IP 192.168.122.239.9801 > 192.168.122.1.60343: Flags [.], ack 560610812, win 1452, options [nop,nop,TS val 4184926367 ecr 413242351], length 0
17:34:04.031721 IP 192.168.122.239.9801 > 192.168.122.1.60343: Flags [.], ack 560612260, win 1452, options [nop,nop,TS val 4184926367 ecr 413242351], length 0
17:34:04.031723 IP 192.168.122.239.9801 > 192.168.122.1.60343: Flags [.], ack 560615156, win 1452, options [nop,nop,TS val 4184926367 ecr 413242351], length 0
17:34:04.031748 IP 192.168.122.1.60343 > 192.168.122.239.9801: Flags [.], seq 560615156:560619500, ack 427075315, win 229, options [nop,nop,TS val 413242351 ecr 4184926367], length 4344
17:34:04.031752 IP 192.168.122.1.60343 > 192.168.122.239.9801: Flags [.], seq 560619500:560622396, ack 427075315, win 229, options [nop,nop,TS val 413242351 ecr 4184926367], length 2896
17:34:04.031760 IP 192.168.122.239.9801 > 192.168.122.1.60343: Flags [.], ack 560619500, win 1452, options [nop,nop,TS val 4184926367 ecr 413242351], length 0
17:34:04.031767 IP 192.168.122.239.9801 > 192.168.122.1.60343: Flags [.], ack 560622396, win 1452, options [nop,nop,TS val 4184926367 ecr 413242351], length 0
17:34:04.031787 IP 192.168.122.1.60343 > 192.168.122.239.9801: Flags [.], seq 560622396:560625292, ack 427075315, win 229, options [nop,nop,TS val 413242351 ecr 4184926367], length 2896
17:34:04.031791 IP 192.168.122.1.60343 > 192.168.122.239.9801: Flags [.], seq 560625292:560629636, ack 427075315, win 229, options [nop,nop,TS val 413242351 ecr 4184926367], length 4344
17:34:04.031799 IP 192.168.122.239.9801 > 192.168.122.1.60343: Flags [.], ack 560625292, win 1452, options [nop,nop,TS val 4184926367 ecr 413242351], length 0
17:34:04.031806 IP 192.168.122.239.9801 > 192.168.122.1.60343: Flags [.], ack 560629636, win 1452, options [nop,nop,TS val 4184926367 ecr 413242351], length 0
17:34:04.031827 IP 192.168.122.1.60343 > 192.168.122.239.9801: Flags [.], seq 560629636:560632532, ack 427075315, win 229, options [nop,nop,TS val 413242351 ecr 4184926367], length 2896
17:34:04.031831 IP 192.168.122.1.60343 > 192.168.122.239.9801: Flags [.], seq 560632532:560636876, ack 427075315, win 229, options [nop,nop,TS val 413242351 ecr 4184926367], length 4344
17:34:04.031839 IP 192.168.122.239.9801 > 192.168.122.1.60343: Flags [.], ack 560632532, win 1452, options [nop,nop,TS val 4184926367 ecr 413242351], length 0
17:34:04.031846 IP 192.168.122.239.9801 > 192.168.122.1.60343: Flags [.], ack 560636876, win 1452, options [nop,nop,TS val 4184926367 ecr 413242351], length 0
17:34:04.031866 IP 192.168.122.1.60343 > 192.168.122.239.9801: Flags [.], seq 560636876:560639772, ack 427075315, win 229, options [nop,nop,TS val 413242351 ecr 4184926367], length 2896
17:34:04.031870 IP 192.168.122.1.60343 > 192.168.122.239.9801: Flags [.], seq 560639772:560644116, ack 427075315, win 229, options [nop,nop,TS val 413242351 ecr 4184926367], length 4344
17:34:04.031878 IP 192.168.122.239.9801 > 192.168.122.1.60343: Flags [.], ack 560639772, win 1452, options [nop,nop,TS val 4184926367 ecr 413242351], length 0
17:34:04.031885 IP 192.168.122.239.9801 > 192.168.122.1.60343: Flags [.], ack 560644116, win 1452, options [nop,nop,TS val 4184926367 ecr 413242351], length 0
17:34:04.031910 IP 192.168.122.1.60343 > 192.168.122.239.9801: Flags [.], seq 560644116:560647012, ack 427075315, win 229, options [nop,nop,TS val 413242351 ecr 4184926367], length 2896
17:34:04.031914 IP 192.168.122.1.60343 > 192.168.122.239.9801: Flags [.], seq 560647012:560651356, ack 427075315, win 229, options [nop,nop,TS val 413242351 ecr 4184926367], length 4344
17:34:04.031922 IP 192.168.122.239.9801 > 192.168.122.1.60343: Flags [.], ack 560647012, win 1452, options [nop,nop,TS val 4184926367 ecr 413242351], length 0
17:34:04.031929 IP 192.168.122.239.9801 > 192.168.122.1.60343: Flags [.], ack 560651356, win 1452, options [nop,nop,TS val 4184926367 ecr 413242351], length 0
17:34:04.031952 IP 192.168.122.1.60343 > 192.168.122.239.9801: Flags [P.], seq 560651356:560654252, ack 427075315, win 229, options [nop,nop,TS val 413242351 ecr 4184926367], length 2896
17:34:04.031956 IP 192.168.122.1.60343 > 192.168.122.239.9801: Flags [.], seq 560654252:560658596, ack 427075315, win 229, options [nop,nop,TS val 413242351 ecr 4184926367], length 4344
17:34:04.031964 IP 192.168.122.239.9801 > 192.168.122.1.60343: Flags [.], ack 560654252, win 1452, options [nop,nop,TS val 4184926367 ecr 413242351], length 0
17:34:04.031971 IP 192.168.122.239.9801 > 192.168.122.1.60343: Flags [.], ack 560658596, win 1452, options [nop,nop,TS val 4184926367 ecr 413242351], length 0
17:34:04.031993 IP 192.168.122.1.60343 > 192.168.122.239.9801: Flags [.], seq 560661492:560665836, ack 427075315, win 229, options [nop,nop,TS val 413242351 ecr 4184926367], length 4344
17:34:04.032003 IP 192.168.122.239.9801 > 192.168.122.1.60343: Flags [.], ack 560658596, win 1452, options [nop,nop,TS val 4184926367 ecr 413242351,nop,nop,sack 1 {560661492:560665836}], length 0
17:34:04.032031 IP 192.168.122.1.60343 > 192.168.122.239.9801: Flags [.], seq 560658596:560661492, ack 427075315, win 229, options [nop,nop,TS val 413242351 ecr 4184926367], length 2896
17:34:04.032034 IP 192.168.122.1.60343 > 192.168.122.239.9801: Flags [.], seq 560665836:560667284, ack 427075315, win 229, options [nop,nop,TS val 413242351 ecr 4184926367], length 1448
17:34:04.032043 IP 192.168.122.239.9801 > 192.168.122.1.60343: Flags [.], ack 560665836, win 1442, options [nop,nop,TS val 4184926367 ecr 413242351], length 0
17:34:04.032049 IP 192.168.122.239.9801 > 192.168.122.1.60343: Flags [.], ack 560667284, win 1434, options [nop,nop,TS val 4184926367 ecr 413242351], length 0
17:34:04.032070 IP 192.168.122.1.60343 > 192.168.122.239.9801: Flags [.], seq 560667284:560670180, ack 427075315, win 229, options [nop,nop,TS val 413242351 ecr 4184926367], length 2896
17:34:04.032074 IP 192.168.122.1.60343 > 192.168.122.239.9801: Flags [.], seq 560670180:560673076, ack 427075315, win 229, options [nop,nop,TS val 413242351 ecr 4184926367], length 2896
17:34:04.032094 IP 192.168.122.239.9801 > 192.168.122.1.60343: Flags [.], ack 560670180, win 1452, options [nop,nop,TS val 4184926367 ecr 413242351], length 0
17:34:04.032102 IP 192.168.122.239.9801 > 192.168.122.1.60343: Flags [.], ack 560673076, win 1452, options [nop,nop,TS val 4184926367 ecr 413242351], length 0
17:34:04.032152 IP 192.168.122.1.60343 > 192.168.122.239.9801: Flags [.], seq 560673076:560675972, ack 427075315, win 229, options [nop,nop,TS val 413242351 ecr 4184926367], length 2896
17:34:04.032157 IP 192.168.122.1.60343 > 192.168.122.239.9801: Flags [.], seq 560675972:560677420, ack 427075315, win 229, options [nop,nop,TS val 413242351 ecr 4184926367], length 1448
17:34:04.032158 IP 192.168.122.1.60343 > 192.168.122.239.9801: Flags [.], seq 560677420:560680316, ack 427075315, win 229, options [nop,nop,TS val 413242351 ecr 4184926367], length 2896
17:34:04.032166 IP 192.168.122.239.9801 > 192.168.122.1.60343: Flags [.], ack 560675972, win 1452, options [nop,nop,TS val 4184926367 ecr 413242351], length 0
17:34:04.032172 IP 192.168.122.239.9801 > 192.168.122.1.60343: Flags [.], ack 560677420, win 1452, options [nop,nop,TS val 4184926367 ecr 413242351], length 0
17:34:04.032174 IP 192.168.122.239.9801 > 192.168.122.1.60343: Flags [.], ack 560680316, win 1452, options [nop,nop,TS val 4184926367 ecr 413242351], length 0
17:34:04.032235 IP 192.168.122.1.60343 > 192.168.122.239.9801: Flags [.], seq 560680316:560683212, ack 427075315, win 229, options [nop,nop,TS val 413242351 ecr 4184926367], length 2896
17:34:04.032239 IP 192.168.122.1.60343 > 192.168.122.239.9801: Flags [.], seq 560683212:560687556, ack 427075315, win 229, options [nop,nop,TS val 413242351 ecr 4184926367], length 4344
17:34:04.032248 IP 192.168.122.239.9801 > 192.168.122.1.60343: Flags [.], ack 560683212, win 1452, options [nop,nop,TS val 4184926367 ecr 413242351], length 0
17:34:04.032254 IP 192.168.122.239.9801 > 192.168.122.1.60343: Flags [.], ack 560687556, win 1452, options [nop,nop,TS val 4184926367 ecr 413242351], length 0
17:34:04.032319 IP 192.168.122.1.60343 > 192.168.122.239.9801: Flags [.], seq 560687556:560690452, ack 427075315, win 229, options [nop,nop,TS val 413242351 ecr 4184926367], length 2896
17:34:04.032323 IP 192.168.122.1.60343 > 192.168.122.239.9801: Flags [P.], seq 560690452:560691900, ack 427075315, win 229, options [nop,nop,TS val 413242351 ecr 4184926367], length 1448
17:34:04.032325 IP 192.168.122.1.60343 > 192.168.122.239.9801: Flags [.], seq 560691900:560694796, ack 427075315, win 229, options [nop,nop,TS val 413242351 ecr 4184926367], length 2896
17:34:04.032333 IP 192.168.122.239.9801 > 192.168.122.1.60343: Flags [.], ack 560690452, win 1452, options [nop,nop,TS val 4184926367 ecr 413242351], length 0
17:34:04.032339 IP 192.168.122.239.9801 > 192.168.122.1.60343: Flags [.], ack 560691900, win 1452, options [nop,nop,TS val 4184926367 ecr 413242351], length 0
17:34:04.032341 IP 192.168.122.239.9801 > 192.168.122.1.60343: Flags [.], ack 560694796, win 1452, options [nop,nop,TS val 4184926367 ecr 413242351], length 0
17:34:04.032404 IP 192.168.122.1.60343 > 192.168.122.239.9801: Flags [.], seq 560694796:560697692, ack 427075315, win 229, options [nop,nop,TS val 413242351 ecr 4184926367], length 2896
17:34:04.032408 IP 192.168.122.1.60343 > 192.168.122.239.9801: Flags [.], seq 560697692:560702036, ack 427075315, win 229, options [nop,nop,TS val 413242351 ecr 4184926367], length 4344
17:34:04.032416 IP 192.168.122.239.9801 > 192.168.122.1.60343: Flags [.], ack 560697692, win 1452, options [nop,nop,TS val 4184926367 ecr 413242351], length 0
17:34:04.032422 IP 192.168.122.239.9801 > 192.168.122.1.60343: Flags [.], ack 560702036, win 1452, options [nop,nop,TS val 4184926367 ecr 413242351], length 0
17:34:04.032486 IP 192.168.122.1.60343 > 192.168.122.239.9801: Flags [.], seq 560702036:560704932, ack 427075315, win 229, options [nop,nop,TS val 413242351 ecr 4184926367], length 2896
17:34:04.032490 IP 192.168.122.1.60343 > 192.168.122.239.9801: Flags [.], seq 560704932:560706380, ack 427075315, win 229, options [nop,nop,TS val 413242351 ecr 4184926367], length 1448
17:34:04.032490 IP 192.168.122.1.60343 > 192.168.122.239.9801: Flags [.], seq 560706380:560709276, ack 427075315, win 229, options [nop,nop,TS val 413242351 ecr 4184926367], length 2896
17:34:04.032499 IP 192.168.122.239.9801 > 192.168.122.1.60343: Flags [.], ack 560704932, win 1452, options [nop,nop,TS val 4184926367 ecr 413242351], length 0
17:34:04.032506 IP 192.168.122.239.9801 > 192.168.122.1.60343: Flags [.], ack 560709276, win 1452, options [nop,nop,TS val 4184926367 ecr 413242351], length 0
17:34:04.032565 IP 192.168.122.1.60343 > 192.168.122.239.9801: Flags [.], seq 560709276:560712172, ack 427075315, win 229, options [nop,nop,TS val 413242351 ecr 4184926367], length 2896
17:34:04.032569 IP 192.168.122.1.60343 > 192.168.122.239.9801: Flags [.], seq 560712172:560716516, ack 427075315, win 229, options [nop,nop,TS val 413242351 ecr 4184926367], length 4344
17:34:04.032577 IP 192.168.122.239.9801 > 192.168.122.1.60343: Flags [.], ack 560712172, win 1452, options [nop,nop,TS val 4184926367 ecr 413242351], length 0
17:34:04.032584 IP 192.168.122.239.9801 > 192.168.122.1.60343: Flags [.], ack 560716516, win 1452, options [nop,nop,TS val 4184926367 ecr 413242351], length 0
17:34:04.032648 IP 192.168.122.1.60343 > 192.168.122.239.9801: Flags [.], seq 560719412:560720860, ack 427075315, win 229, options [nop,nop,TS val 413242351 ecr 4184926367], length 1448
17:34:04.032651 IP 192.168.122.1.60343 > 192.168.122.239.9801: Flags [.], seq 560720860:560723756, ack 427075315, win 229, options [nop,nop,TS val 413242351 ecr 4184926367], length 2896
17:34:04.032660 IP 192.168.122.239.9801 > 192.168.122.1.60343: Flags [.], ack 560716516, win 1452, options [nop,nop,TS val 4184926367 ecr 413242351,nop,nop,sack 1 {560719412:560720860}], length 0
17:34:04.032666 IP 192.168.122.239.9801 > 192.168.122.1.60343: Flags [.], ack 560716516, win 1452, options [nop,nop,TS val 4184926367 ecr 413242351,nop,nop,sack 1 {560719412:560723756}], length 0
17:34:04.032696 IP 192.168.122.1.60343 > 192.168.122.239.9801: Flags [.], seq 560723756:560725204, ack 427075315, win 229, options [nop,nop,TS val 413242351 ecr 4184926367], length 1448
17:34:04.032699 IP 192.168.122.1.60343 > 192.168.122.239.9801: Flags [.], seq 560716516:560719412, ack 427075315, win 229, options [nop,nop,TS val 413242351 ecr 4184926367], length 2896
17:34:04.032708 IP 192.168.122.239.9801 > 192.168.122.1.60343: Flags [.], ack 560716516, win 1452, options [nop,nop,TS val 4184926367 ecr 413242351,nop,nop,sack 1 {560719412:560725204}], length 0
17:34:04.032715 IP 192.168.122.239.9801 > 192.168.122.1.60343: Flags [.], ack 560725204, win 1432, options [nop,nop,TS val 4184926367 ecr 413242351], length 0
17:34:04.032740 IP 192.168.122.1.60343 > 192.168.122.239.9801: Flags [.], seq 560725204:560726652, ack 427075315, win 229, options [nop,nop,TS val 413242351 ecr 4184926367], length 1448
17:34:04.032742 IP 192.168.122.1.60343 > 192.168.122.239.9801: Flags [.], seq 560726652:560729548, ack 427075315, win 229, options [nop,nop,TS val 413242351 ecr 4184926367], length 2896
17:34:04.032751 IP 192.168.122.239.9801 > 192.168.122.1.60343: Flags [.], ack 560726652, win 1452, options [nop,nop,TS val 4184926367 ecr 413242351], length 0
17:34:04.032758 IP 192.168.122.239.9801 > 192.168.122.1.60343: Flags [.], ack 560729548, win 1452, options [nop,nop,TS val 4184926367 ecr 413242351], length 0
17:34:04.032782 IP 192.168.122.1.60343 > 192.168.122.239.9801: Flags [.], seq 560729548:560732444, ack 427075315, win 229, options [nop,nop,TS val 413242351 ecr 4184926367], length 2896
17:34:04.032786 IP 192.168.122.1.60343 > 192.168.122.239.9801: Flags [P.], seq 560732444:560735340, ack 427075315, win 229, options [nop,nop,TS val 413242351 ecr 4184926367], length 2896
17:34:04.032809 IP 192.168.122.239.9801 > 192.168.122.1.60343: Flags [.], ack 560732444, win 1452, options [nop,nop,TS val 4184926367 ecr 413242351], length 0
17:34:04.032817 IP 192.168.122.239.9801 > 192.168.122.1.60343: Flags [.], ack 560735340, win 1452, options [nop,nop,TS val 4184926367 ecr 413242351], length 0
17:34:04.032839 IP 192.168.122.1.60343 > 192.168.122.239.9801: Flags [.], seq 560735340:560739684, ack 427075315, win 229, options [nop,nop,TS val 413242351 ecr 4184926367], length 4344
17:34:04.032843 IP 192.168.122.1.60343 > 192.168.122.239.9801: Flags [.], seq 560739684:560742580, ack 427075315, win 229, options [nop,nop,TS val 413242351 ecr 4184926367], length 2896
17:34:04.032851 IP 192.168.122.239.9801 > 192.168.122.1.60343: Flags [.], ack 560739684, win 1452, options [nop,nop,TS val 4184926367 ecr 413242351], length 0
17:34:04.032858 IP 192.168.122.239.9801 > 192.168.122.1.60343: Flags [.], ack 560742580, win 1452, options [nop,nop,TS val 4184926367 ecr 413242351], length 0
17:34:04.032880 IP 192.168.122.1.60343 > 192.168.122.239.9801: Flags [.], seq 560746924:560749820, ack 427075315, win 229, options [nop,nop,TS val 413242351 ecr 4184926367], length 2896
17:34:04.032890 IP 192.168.122.239.9801 > 192.168.122.1.60343: Flags [.], ack 560742580, win 1452, options [nop,nop,TS val 4184926367 ecr 413242351,nop,nop,sack 1 {560746924:560749820}], length 0
17:34:04.032916 IP 192.168.122.1.60343 > 192.168.122.239.9801: Flags [.], seq 560742580:560745476, ack 427075315, win 229, options [nop,nop,TS val 413242351 ecr 4184926367], length 2896
17:34:04.032927 IP 192.168.122.239.9801 > 192.168.122.1.60343: Flags [.], ack 560745476, win 1448, options [nop,nop,TS val 4184926367 ecr 413242351,nop,nop,sack 1 {560746924:560749820}], length 0
17:34:04.032950 IP 192.168.122.1.60343 > 192.168.122.239.9801: Flags [.], seq 560749820:560752716, ack 427075315, win 229, options [nop,nop,TS val 413242351 ecr 4184926367], length 2896
17:34:04.032960 IP 192.168.122.239.9801 > 192.168.122.1.60343: Flags [.], ack 560745476, win 1448, options [nop,nop,TS val 4184926367 ecr 413242351,nop,nop,sack 1 {560746924:560752716}], length 0
17:34:04.032984 IP 192.168.122.1.60343 > 192.168.122.239.9801: Flags [.], seq 560745476:560746924, ack 427075315, win 229, options [nop,nop,TS val 413242351 ecr 4184926367], length 1448
17:34:04.032987 IP 192.168.122.1.60343 > 192.168.122.239.9801: Flags [.], seq 560752716:560755612, ack 427075315, win 229, options [nop,nop,TS val 413242351 ecr 4184926367], length 2896
17:34:04.032996 IP 192.168.122.239.9801 > 192.168.122.1.60343: Flags [.], ack 560752716, win 1434, options [nop,nop,TS val 4184926367 ecr 413242351], length 0
17:34:04.033003 IP 192.168.122.239.9801 > 192.168.122.1.60343: Flags [.], ack 560755612, win 1420, options [nop,nop,TS val 4184926367 ecr 413242351], length 0
17:34:04.033025 IP 192.168.122.1.60343 > 192.168.122.239.9801: Flags [.], seq 560755612:560757060, ack 427075315, win 229, options [nop,nop,TS val 413242351 ecr 4184926367], length 1448
17:34:04.033028 IP 192.168.122.1.60343 > 192.168.122.239.9801: Flags [.], seq 560757060:560761404, ack 427075315, win 229, options [nop,nop,TS val 413242351 ecr 4184926367], length 4344
17:34:04.033037 IP 192.168.122.239.9801 > 192.168.122.1.60343: Flags [.], ack 560757060, win 1452, options [nop,nop,TS val 4184926367 ecr 413242351], length 0
17:34:04.033044 IP 192.168.122.239.9801 > 192.168.122.1.60343: Flags [.], ack 560761404, win 1452, options [nop,nop,TS val 4184926367 ecr 413242351], length 0
17:34:04.033068 IP 192.168.122.1.60343 > 192.168.122.239.9801: Flags [.], seq 560761404:560764300, ack 427075315, win 229, options [nop,nop,TS val 413242351 ecr 4184926367], length 2896
